Symbol,Name,Last Sale,Net Change,% Change,Market Cap,Country,IPO Year,Volume,Sector,Industry
KBSX,FST Corp. Ordinary Shares,$1.38,-0.0179,-1.28%,52094146.00,Taiwan,,4998,Consumer Discretionary,Recreational Games/Products/Toys
KC,Kingsoft Cloud Holdings Limited American Depositary Shares,$10.73,0.06,0.562%,2920552057.00,China,2020,381312,Technology,Computer Software: Prepackaged Software
KCHV,Kochav Defense Acquisition Corp. Class A Ordinary Shares,$10.12,0.00,0.00%,0.00,United States,2025,55,,
KCHVU,Kochav Defense Acquisition Corp. Units,$10.346,-0.044,-0.423%,0.00,United States,2025,102,,
KD,Kyndryl Holdings Inc. Common Stock,$27.22,-0.06,-0.22%,6221521525.00,United States,2021,1150452,Technology,EDP Services
KDK,Kodiak AI Inc. Common Stock ,$10.30,-0.14,-1.341%,1866436138.00,United States,,636017,Technology,EDP Services
KDKRW,Kodiak AI Inc. Warrants,$1.44,-0.17,-10.559%,260938644.00,United States,,5173,Technology,EDP Services
KDP,Keurig Dr Pepper Inc. Common Stock,$28.10,0.10,0.357%,38176185813.00,United States,,5889561,Consumer Staples,Beverages (Production/Distribution)
KE,Kimball Electronics Inc. Common Stock,$29.21,0.23,0.794%,710923583.00,United States,,101110,Technology,Electrical Products
KELYA,Kelly Services Inc. Class A Common Stock,$8.61,0.01,0.116%,304268842.00,United States,,403180,Consumer Discretionary,Professional Services
KELYB,Kelly Services Inc. Class B Common Stock,$8.481,-0.5887,-6.491%,299710110.00,United States,,622,Consumer Discretionary,Professional Services
KEN,Kenon Holdings Ltd. Ordinary Shares,$64.29,-2.31,-3.468%,3352739058.00,Singapore,2015,19800,Utilities,Electric Utilities: Central
KEP,Korea Electric Power Corporation Common Stock,$17.09,0.23,1.364%,21942332152.00,South Korea,1994,366083,Utilities,Electric Utilities: Central
KEQU,Kewaunee Scientific Corporation Common Stock,$38.00,-0.01,-0.026%,108922592.00,United States,,5082,Industrials,Medical Specialities
KEX,Kirby Corporation Common Stock,$110.89,0.05,0.045%,6010238000.00,United States,,303225,Consumer Discretionary,Marine Transportation
KEY,KeyCorp Common Stock,$21.19,0.05,0.237%,23158966091.00,United States,,7615789,Finance,Major Banks
KEY^I,KeyCorp Depositary Shares Each Representing a 1/40th Ownership Interest in a Share of Fixed-to-Floating Rate Perpetual Non-Cumulative Preferred Stock Series E,$24.72,-0.07,-0.282%,,United States,,90979,,
KEY^J,KeyCorp Depositary Shares each representing a 1/40th ownership interest in a share of Fixed Rate Perpetual Non-Cumulative Preferred Stock Series F,$21.35,-0.08,-0.373%,,United States,,18028,,
KEY^K,KeyCorp Depositary Shares each representing a 1/40th ownership interest in a share of Fixed Rate Perpetual Non-Cumulative Preferred Stock Series G,$21.36,0.01,0.047%,,United States,,18436,,
KEY^L,KeyCorp Depositary Shares each representing a 1/40th ownership interest in a share of Fixed Rate Perpetual Non-Cumulative Preferred Stock Series H,$25.08,-0.08,-0.318%,,United States,,22550,,
KEYS,Keysight Technologies Inc. Common Stock,$206.04,0.71,0.346%,35401200847.00,United States,2014,462864,Industrials,Industrial Machinery/Components
KF,Korea Fund Inc. (The) New Common Stock,$35.96,0.47,1.324%,0.00,United States,,13678,Finance,Investment Managers
KFFB,Kentucky First Federal Bancorp Common Stock,$4.50,0.15,3.448%,36390218.00,United States,2005,7651,Finance,Savings Institutions
KFIIR,K&F Growth Acquisition Corp. II Rights,$0.20,0.00,0.00%,0.00,United States,2025,10,,
KFIIU,K&F Growth Acquisition Corp. II Unit,$10.75,0.24,2.284%,0.00,United States,2025,2073,Finance,Blank Checks
KFRC,Kforce Inc. Common Stock,$31.41,0.40,1.29%,569808810.00,United States,1995,170232,Consumer Discretionary,Professional Services
KFS,Kingsway Financial Services Inc. Common Stock (DE),$13.90,0.29,2.131%,402490513.00,Canada,,49545,Finance,Property-Casualty Insurers
KFY,Korn Ferry Common Stock,$67.10,0.45,0.675%,3502280742.00,United States,1999,353196,Consumer Discretionary,Diversified Commercial Services
KG,Kestrel Group Ltd.,$10.19,-0.25,-2.395%,78890399.00,Bermuda,2008,32690,Finance,Property-Casualty Insurers
KGC,Kinross Gold Corporation Common Stock,$29.70,0.43,1.469%,35850870000.00,Canada,2001,4457264,Basic Materials,Precious Metals
KGEI,Kolibri Global Energy Inc. Common stock,$4.20,0.09,2.19%,148582699.00,United States,,112375,Energy,Oil & Gas Production
KGS,Kodiak Gas Services Inc. Common Stock,$36.35,-0.37,-1.008%,3150958311.00,United States,2023,1004475,Utilities,Natural Gas Distribution
KHC,The Kraft Heinz Company Common Stock,$24.13,0.11,0.458%,28561609121.00,United States,,9075610,Consumer Staples,Packaged Foods
KIDS,OrthoPediatrics Corp. Common Stock,$17.34,-0.07,-0.402%,434840902.00,United States,2017,98576,Health Care,Medical/Dental Instruments
KIDZ,Classover Holdings Inc. Class B Common Stock,$0.2022,-0.0056,-2.695%,5667369.00,United States,,698142,Real Estate,Other Consumer Services
KIDZW,Classover Holdings Inc. Warrants,$0.0219,0.0044,25.143%,613825.00,United States,,79263,Real Estate,Other Consumer Services
KIM,Kimco Realty Corporation (HC) Common Stock,$20.36,-0.06,-0.294%,13787692684.00,United States,,2874599,Real Estate,Real Estate Investment Trusts
KIM^L,Kimco Realty Corporation Class L Depositary Shares each of which represents a one-one thousandth fractional interest in a share of 5.125% Class L Cumulative Redeemable Preferred Stock liquidation preference $25000.00 per share,$20.04,-0.0351,-0.175%,,United States,,15233,,
KIM^M,Kimco Realty Corporation Class M Depositary Shares each of which represents a one-one thousandth fractional interest in a share of 5.25% Class M Cumulative Redeemable Preferred Stock liquidation preference $25000.00 per share,$20.44,-0.01,-0.049%,,United States,,13317,,
KIM^N,Kimco Realty Corporation Depositary Shares each representing 1/1000th interest in a share of 7.25% Class N Cumulative Convertible Perpetual Preferred Stock,$56.75,-1.00,-1.732%,,United States,,284,,
KINS,Kingstone Companies Inc. Common Stock,$17.31,-0.07,-0.403%,244891979.00,United States,,133860,Finance,Property-Casualty Insurers
KIO,KKR Income Opportunities Fund Common Shares,$11.68,0.06,0.516%,0.00,United States,2013,272197,Finance,Investment Managers
KITT,Nauticus Robotics Inc. Common stock,$0.90,-0.0047,-0.52%,12339554.00,United States,2021,1965571,Industrials,Industrial Machinery/Components
KITTW,Nauticus Robotics Inc. Warrant,$0.0901,0.0051,6.00%,1235326.00,United States,2021,110959,Industrials,Industrial Machinery/Components
KKR,KKR & Co. Inc. Common Stock,$130.41,-0.37,-0.283%,116241398198.00,United States,,2193895,Finance,Investment Managers
KKR^D,KKR & Co. Inc. 6.25% Series D Mandatory Convertible Preferred Stock,$52.48,-0.07,-0.133%,,United States,,8349,,
KKRS,KKR Group Finance Co. IX LLC 4.625% Subordinated Notes due 2061,$17.31,0.05,0.29%,15429327527.00,United States,2021,17471,Finance,Investment Managers
KKRT,KKR & Co. Inc. 6.875% Subordinated Notes due 2065,$25.73,-0.04,-0.155%,0.00,United States,2025,11222,Finance,Investment Managers
KLAC,KLA Corporation Common Stock,$1279.60,2.61,0.204%,168129635705.00,United States,1980,337415,Technology,Electronic Components
KLAR,Klarna Group plc Ordinary Shares,$29.59,-0.83,-2.728%,21273703780.00,,2025,1978357,Finance,Finance: Consumer Services
KLC,KinderCare Learning Companies Inc. Common Stock,$4.28,0.00,0.00%,506403411.00,United States,2024,416152,Consumer Discretionary,Other Consumer Services
KLIC,Kulicke and Soffa Industries Inc. Common Stock,$46.75,0.30,0.646%,2447970250.00,Singapore,,241408,Technology,Semiconductors
KLRS,Kalaris Therapeutics Inc. Common Stock,$9.255,-0.325,-3.392%,173090879.00,United States,2020,91644,Health Care,Biotechnology: Biological Products (No Diagnostic Substances)
KLTO,Klotho Neurosciences Inc. Common Stock,$0.3466,-0.0173,-4.754%,25141228.00,United States,2022,612659,Health Care,Biotechnology: Biological Products (No Diagnostic Substances)
KLTOW,Klotho Neurosciences Inc. Warrant,$0.1142,-0.0046,-3.872%,8283694.00,United States,2022,5242,Health Care,Biotechnology: Biological Products (No Diagnostic Substances)
KLTR,Kaltura Inc. Common Stock,$1.66,-0.04,-2.353%,259514701.00,United States,2021,59703,Technology,Computer Software: Prepackaged Software
KLXE,KLX Energy Services Holdings Inc. Common Stock,$1.58,-0.12,-7.059%,28184238.00,United States,,138930,Energy,Oilfield Services/Equipment
KMB,Kimberly-Clark Corporation Common Stock,$101.00,-0.08,-0.079%,33521204716.00,United States,,2673526,Consumer Discretionary,Containers/Packaging
KMDA,Kamada Ltd. Ordinary Shares,$7.07,-0.02,-0.282%,406560569.00,Israel,2013,54309,Health Care,Biotechnology: Pharmaceutical Preparations
KMI,Kinder Morgan Inc. Common Stock,$27.19,0.00,0.00%,60491235004.00,United States,2011,5094044,Utilities,Natural Gas Distribution
KMPB,Kemper Corporation 5.875% Fixed-Rate Reset Junior Subordinated Debentures due 2062,$23.44,0.00,0.00%,1372338398.00,United States,2022,3885,Finance,Property-Casualty Insurers
KMPR,Kemper Corporation,$40.92,-0.06,-0.146%,2395737511.00,United States,,393991,Finance,Property-Casualty Insurers
KMRK,K-Tech Solutions Company Limited Class A Ordinary Shares,$1.11,0.01,0.909%,21645000.00,Hong Kong,2025,38268,Consumer Discretionary,Recreational Games/Products/Toys
KMT,Kennametal Inc. Common Stock,$29.28,0.02,0.068%,2228007022.00,United States,,316567,Industrials,Industrial Machinery/Components
KMTS,Kestra Medical Technologies Ltd. Common Stock,$27.13,-0.39,-1.417%,1583009808.00,United States,2025,111164,Health Care,Medical/Dental Instruments
KMX,CarMax Inc,$39.27,0.09,0.23%,5568354092.00,United States,,2562322,Consumer Discretionary,Retail-Auto Dealers and Gas Stations
KN,Knowles Corporation Common Stock,$21.90,-0.17,-0.77%,1864826260.00,United States,2014,375659,Consumer Staples,Consumer Electronics/Appliances
KNDI,Kandi Technologies Group Inc. Ordinary Shares,$0.8461,-0.0089,-1.041%,73913802.00,China,,100039,Industrials,Auto Manufacturing
KNF,Knife Riv Holding Co. Common Stock,$73.68,0.22,0.299%,4175015677.00,United States,2023,233755,Industrials,Mining & Quarrying of Nonmetallic Minerals (No Fuels)
KNOP,KNOT Offshore Partners LP Common Units representing Limited Partner Interests,$10.61,0.11,1.048%,361218309.00,United Kingdom,2013,54708,Consumer Discretionary,Marine Transportation
KNRX,KNOREX LTD. Class A Ordinary Shares,$1.54,0.09,6.207%,46851594.00,,2025,13135,Technology,Computer Software: Programming Data Processing
KNSA,Kiniksa Pharmaceuticals International plc Class A Ordinary Shares,$42.00,-0.49,-1.153%,3183421878.00,United States,2018,199919,Health Care,Biotechnology: Pharmaceutical Preparations
KNSL,Kinsale Capital Group Inc. Common Stock,$393.39,-3.25,-0.819%,9151599154.00,United States,,163212,Finance,Property-Casualty Insurers
KNTK,Kinetik Holdings Inc. Class A Common Stock,$35.46,-0.27,-0.756%,5729805731.00,United States,2022,601523,Utilities,Natural Gas Distribution
KNX,Knight-Swift Transportation Holdings Inc.,$53.29,-0.28,-0.523%,8651045310.00,United States,2017,948702,Industrials,Trucking Freight/Courier Services
KO,Coca-Cola Company (The) Common Stock,$69.87,-0.24,-0.342%,300553410000.00,United States,,5703514,Consumer Staples,Beverages (Production/Distribution)
KOD,Kodiak Sciences Inc Common Stock,$29.89,-1.19,-3.829%,1792057431.00,United States,2018,964865,Health Care,Biotechnology: Biological Products (No Diagnostic Substances)
KODK,Eastman Kodak Company Common New,$8.74,-0.20,-2.237%,842536000.00,United States,,615431,Consumer Discretionary,Industrial Machinery/Components
KOF,Coca Cola Femsa S.A.B. de C.V.  American Depositary Shares each representing 10 Units (each Unit consists of 3 Series B Shares and 5 Series L Shares),$96.65,0.83,0.866%,20304543793.00,Mexico,1993,52014,Consumer Staples,Beverages (Production/Distribution)
KOP,Koppers Holdings Inc. Common Stock,$26.95,-0.30,-1.101%,528595306.00,United States,2006,119255,Basic Materials,Forest Products
KOPN,Kopin Corporation Common Stock,$2.38,-0.07,-2.857%,439718397.00,United States,1992,1040252,Technology,Semiconductors
KORE,KORE Group Holdings Inc. Common Stock,$4.39,-0.01,-0.227%,77000323.00,United States,,6667,Telecommunications,Telecommunications Equipment
KOS,Kosmos Energy Ltd. Common Shares (DE),$0.8707,-0.0336,-3.716%,416479279.00,Bermuda,2011,15590807,Energy,Oil & Gas Production
KOSS,Koss Corporation Common Stock,$4.49,0.03,0.673%,42459407.00,United States,,16859,Consumer Staples,Consumer Electronics/Appliances
KOYN,CSLM Digital Asset Acquisition Corp III Class A Ordinary Shares,$9.95,0.00,0.00%,0.00,United States,2025,115048,,
KOYNW,CSLM Digital Asset Acquisition Corp III Warrants,$0.3559,-0.0301,-7.798%,0.00,United States,2025,6603,,
KPLT,Katapult Holdings Inc. Common Stock,$6.85,0.26,3.945%,31806838.00,United States,2019,144098,Consumer Discretionary,Diversified Commercial Services
KPLTW,Katapult Holdings Inc. Warrant,$0.0037,0.0003,8.824%,17180.00,United States,2019,21491,Consumer Discretionary,Diversified Commercial Services
KPRX,Kiora Pharmaceuticals Inc.  Common Stock,$1.97,-0.08,-3.902%,7245532.00,United States,,15894,Health Care,Biotechnology: Pharmaceutical Preparations
KPTI,Karyopharm Therapeutics Inc. Common Stock,$7.44,-0.03,-0.402%,126858517.00,United States,2013,106297,Health Care,Biotechnology: Pharmaceutical Preparations
KR,Kroger Company (The) Common Stock,$63.25,0.32,0.509%,40027709370.00,United States,,3596377,Consumer Staples,Food Chains
KRC,Kilroy Realty Corporation Common Stock,$38.07,0.07,0.184%,4503898075.00,United States,1997,704052,Real Estate,Real Estate Investment Trusts
KREF,KKR Real Estate Finance Trust Inc. Common Stock,$8.52,-0.05,-0.583%,557963554.00,United States,2017,514517,Real Estate,Real Estate Investment Trusts
KREF^A,KKR Real Estate Finance Trust Inc. 6.50% Series A Cumulative Redeemable Preferred Stock,$18.44,-0.01,-0.054%,,United States,,17168,,
KRG,Kite Realty Group Trust Common Stock,$24.10,0.07,0.291%,5217793949.00,United States,2004,1062332,Real Estate,Real Estate Investment Trusts
KRKR,36Kr Holdings Inc. American Depositary Shares,$4.50,0.255,6.007%,177369494.00,China,2019,17079,Real Estate,Real Estate
KRMD,KORU Medical Systems Inc. Common Stock (DE),$6.23,-0.25,-3.858%,288590141.00,United States,,74607,Health Care,Medical/Dental Instruments
KRMN,Karman Holdings Inc. Common Stock,$77.55,-3.26,-4.034%,10261604834.00,United States,2025,694481,Industrials,Military/Government/Technical
KRNT,Kornit Digital Ltd. Ordinary Shares,$14.49,-0.11,-0.753%,656795518.00,Israel,2015,135770,Industrials,Industrial Machinery/Components
KRNY,Kearny Financial Corp Common Stock,$7.58,-0.08,-1.044%,490722765.00,United States,2005,260500,Finance,Savings Institutions
KRO,Kronos Worldwide Inc Common Stock,$4.59,0.00,0.00%,528093802.00,United States,,209035,Basic Materials,Major Chemicals
KROS,Keros Therapeutics Inc. Common Stock,$21.03,-0.33,-1.545%,640701431.00,United States,2020,313500,Health Care,Biotechnology: Pharmaceutical Preparations
KRP,Kimbell Royalty Partners Common Units Representing Limited Partner Interests,$11.58,0.04,0.347%,1249343364.00,United States,2017,580370,Energy,Oil & Gas Production
KRRO,Korro Bio Inc. Common Stock,$8.12,-0.29,-3.448%,76468435.00,United States,2019,99854,Health Care,Biotechnology: Pharmaceutical Preparations
KRSP,Rice Acquisition Corporation 3 Class A Ordinary Shares,$10.28,0.00,0.00%,0.00,,2025,1068,,
KRT,Karat Packaging Inc. Common Stock,$22.81,0.03,0.132%,458469709.00,United States,2021,43553,Industrials,Plastic Products
KRUS,Kura Sushi USA Inc. Class A Common Stock,$56.44,0.98,1.767%,683571762.00,United States,2019,252672,Consumer Discretionary,Restaurants
KRYS,Krystal Biotech Inc. Common Stock,$252.17,0.88,0.35%,7312304366.00,United States,2017,151250,Health Care,Biotechnology: Biological Products (No Diagnostic Substances)
KSCP,Knightscope Inc. Class A Common Stock,$3.96,0.09,2.326%,45575094.00,United States,2022,358539,Telecommunications,Telecommunications Equipment
KSPI,Joint Stock Company Kaspi.kz American Depository Shares,$78.65,0.24,0.306%,14891077022.00,Kazakhstan,2024,221360,,
KSS,Kohl's Corporation Common Stock,$21.57,-0.03,-0.139%,2419920850.00,United States,1992,3294124,Consumer Discretionary,Department/Specialty Retail Stores
KT,KT Corporation Common Stock,$19.15,0.12,0.631%,9415401832.00,South Korea,,665577,Telecommunications,Telecommunications Equipment
KTB,Kontoor Brands Inc. Common Stock ,$62.90,0.46,0.737%,3496838195.00,United States,2019,487519,Industrials,Garments and Clothing
KTCC,Key Tronic Corporation Common Stock,$2.58,0.01,0.389%,28016914.00,United States,1983,9312,Technology,Electrical Products
KTF,DWS Municipal Income Trust,$9.04,0.01,0.111%,357088480.00,United States,1988,167504,Finance,Finance Companies
KTH,Structures Products Cp 8% CorTS Issued by Peco Energy Cap Tr II Preferred Stock,$28.52,0.02,0.07%,0.00,United States,,226,Finance,Finance: Consumer Services
KTN,Structured Products Corp 8.205% CorTS 8.205% Corporate Backed Trust Securities (CorTS),$26.53,-0.17,-0.637%,0.00,United States,,2500,Finance,Finance: Consumer Services
KTOS,Kratos Defense & Security Solutions Inc. Common Stock,$77.70,-2.27,-2.839%,13118923012.00,United States,,1618796,Industrials,Military/Government/Technical
KTTA,Pasithea Therapeutics Corp. Common Stock,$1.12,-0.05,-4.274%,25086790.00,United States,2021,147782,Health Care,Biotechnology: Pharmaceutical Preparations
KTTAW,Pasithea Therapeutics Corp. Warrant,$0.012,-0.0005,-4.00%,268787.00,United States,2021,28845,Health Care,Biotechnology: Pharmaceutical Preparations
KULR,KULR Technology Group Inc. Common Stock,$3.42,-0.15,-4.202%,156232532.00,United States,,823524,Technology,Electrical Products
KURA,Kura Oncology Inc. Common Stock,$10.63,-0.43,-3.888%,924996216.00,United States,,1168751,Health Care,Biotechnology: Pharmaceutical Preparations
KVAC,Keen Vision Acquisition Corporation Ordinary Shares,$11.79,0.00,0.00%,0.00,United States,2023,2,,
KVACW,Keen Vision Acquisition Corporation Warrant,$0.051,0.00,0.00%,0.00,United States,2023,2,,
KVHI,KVH Industries Inc. Common Stock,$6.79,-0.01,-0.147%,132902374.00,United States,1996,35273,Technology,Radio And Television Broadcasting And Communications Equipment
KVUE,Kenvue Inc. Common Stock,$17.19,-0.02,-0.116%,32932639302.00,United States,2023,15560953,Consumer Discretionary,Specialty Chemicals
KVYO,Klaviyo Inc. Series A Common Stock,$32.59,0.20,0.617%,9840396675.00,United States,2023,719915,Technology,Computer Software: Prepackaged Software
KW,Kennedy-Wilson Holdings Inc. Common Stock,$9.72,-0.01,-0.103%,1340430710.00,United States,,272250,Finance,Real Estate
KWM,K Wave Media Ltd. Ordinary Shares,$0.39,-0.02,-4.878%,29444717.00,Cayman Islands,,953073,Consumer Discretionary,Movies/Entertainment
KWMWW,K Wave Media Ltd. Warrant,$0.0211,-0.0009,-4.091%,1593035.00,Cayman Islands,,34981,Consumer Discretionary,Movies/Entertainment
KWR,Quaker Houghton Common Stock,$144.55,1.62,1.133%,2506502059.00,United States,,69818,Industrials,Major Chemicals
KXIN,Kaixin Holdings Ordinary Shares,$6.00,1.26,26.582%,5671644.00,China,2017,1159566,Consumer Discretionary,Retail-Auto Dealers and Gas Stations
KYIV,Kyivstar Group Ltd. Common Shares,$13.49,0.00,0.00%,3217771750.00,United Arab Emirates,,539901,Telecommunications,Telecommunications Equipment
KYIVW,Kyivstar Group Ltd. Warrant,$4.15,-0.07,-1.659%,989900131.00,United Arab Emirates,,40477,Telecommunications,Telecommunications Equipment
KYMR,Kymera Therapeutics Inc. Common Stock,$81.32,-1.81,-2.177%,6403232270.00,United States,2020,418607,Health Care,Biotechnology: Biological Products (No Diagnostic Substances)
KYN,Kayne Anderson Energy Infrastructure Fund Inc.,$12.09,-0.05,-0.412%,1645830198.00,United States,2004,219245,Finance,Finance/Investors Services
KYTX,Kyverna Therapeutics Inc. Common Stock,$9.40,0.41,4.561%,536997748.00,United States,2024,1069313,Health Care,Biotechnology: Biological Products (No Diagnostic Substances)
KZIA,Kazia Therapeutics Limited American Depositary Shares,$7.57,-0.43,-5.375%,85813452.00,Australia,,146369,Health Care,Biotechnology: Pharmaceutical Preparations
KZR,Kezar Life Sciences Inc. Common Stock,$6.34,0.00,0.00%,46428809.00,United States,2018,10894,Health Care,Biotechnology: Pharmaceutical Preparations
L,Loews Corporation Common Stock,$106.40,-0.93,-0.866%,21988577929.00,United States,,342261,Finance,Property-Casualty Insurers
LAB,Standard BioTools Inc. Common Stock,$1.38,-0.09,-6.122%,530700271.00,United States,2011,1436602,Industrials,Biotechnology: Laboratory Analytical Instruments
LAC,Lithium Americas Corp. Common Shares,$4.69,-0.17,-3.498%,1423360071.00,Canada,2023,7907889,Basic Materials,Metal Mining
LAD,Lithia Motors Inc. Common Stock,$344.41,-1.00,-0.29%,8351952832.00,United States,,108363,Consumer Discretionary,Retail-Auto Dealers and Gas Stations
LADR,Ladder Capital Corp Class A Common Stock,$11.33,-0.01,-0.088%,1442551349.00,United States,2014,363287,Real Estate,Real Estate Investment Trusts
LAES,SEALSQ Corp Ordinary Shares,$4.01,-0.15,-3.606%,419080693.00,Switzerland,,8459357,Technology,Semiconductors
LAFA,LaFayette Acquisition Corp. Ordinary Share,$9.91,0.01,0.101%,0.00,France,2025,503,,
LAFAU,LaFayette Acquisition Corp. Unit,$10.055,0.035,0.349%,0.00,France,2025,100,,
LAKE,Lakeland Industries Inc. Common Stock,$8.64,-0.10,-1.144%,84724946.00,United States,1986,143701,Health Care,Industrial Specialties
LAMR,Lamar Advertising Company Class A Common Stock,$126.55,-0.24,-0.189%,12817449957.00,United States,1996,201152,Real Estate,Real Estate Investment Trusts
LAND,Gladstone Land Corporation Common Stock,$8.81,-0.06,-0.676%,328320799.00,United States,2013,349661,Real Estate,Real Estate Investment Trusts
LANDM,Gladstone Land Corporation 5.00% Series D Cumulative Term Preferred Stock,$24.90,0.02,0.08%,927944142.00,United States,,3357,Real Estate,Real Estate Investment Trusts
LANDO,Gladstone Land Corporation 6.00% Series B Cumulative Redeemable Preferred Stock,$18.59,-0.06,-0.322%,692790425.00,United States,,18334,Real Estate,Real Estate Investment Trusts
LANDP,Gladstone Land Corporation 6.00% Series C Cumulative Redeemable Preferred Stock,$18.62,-0.01,-0.054%,693908430.00,United States,,15091,Real Estate,Real Estate Investment Trusts
LANV,Lanvin Group Holdings Limited Ordinary Shares,$1.91,0.08,4.372%,266971786.00,Cayman Islands,2022,28403,Consumer Discretionary,Apparel
LAR,Lithium Argentina AG Common Shares,$5.54,-0.11,-1.947%,899142000.00,Canada,2023,2212902,Basic Materials,Metal Mining
LARK,Landmark Bancorp Inc. Common Stock,$27.53,-0.50,-1.784%,167223579.00,United States,,4276,Finance,Major Banks
LASE,Laser Photonics Corporation Common Stock,$2.65,-0.15,-5.357%,59181989.00,United States,2022,185299,Miscellaneous,Industrial Machinery/Components
LASR,nLIGHT Inc. Common Stock,$39.20,-0.12,-0.305%,1990811474.00,United States,2018,266570,Technology,Semiconductors
LATA,Galata Acquisition Corp. II Class A Ordinary Shares,$9.97,0.00,0.00%,0.00,United States,2025,14,Finance,Blank Checks
LATAW,Galata Acquisition Corp. II Warrant,$0.40,0.025,6.667%,0.00,United States,2025,200,Finance,Blank Checks
LAUR,Laureate Education Inc. Common Stock,$34.35,0.51,1.507%,5062130715.00,United States,2017,542462,Real Estate,Other Consumer Services
LAW,CS Disco Inc. Common Stock,$7.99,-0.08,-0.991%,499307836.00,United States,2021,114296,Technology,Computer Software: Prepackaged Software
LAZ,Lazard Inc. Common Stock,$50.04,0.52,1.05%,5641840164.00,Bermuda,2005,458867,Finance,Investment Managers
LB,LandBridge Company LLC Class A Shares Representing Limited Liability Company Interests,$51.96,-1.14,-2.147%,4005550415.00,,2024,261547,Energy,Oil & Gas Production
LBGJ,Li Bang International Corporation Inc. Class A Ordinary Shares,$0.575,0.0184,3.306%,10780100.00,China,2024,37723,Industrials,Industrial Machinery/Components
LBRDA,Liberty Broadband Corporation Class A Common Stock,$48.09,-0.23,-0.476%,6900414046.00,United States,,63245,Telecommunications,Cable & Other Pay Television Services
LBRDK,Liberty Broadband Corporation Class C Common Stock,$48.25,-0.20,-0.413%,6923372380.00,United States,,592158,Telecommunications,Cable & Other Pay Television Services
LBRDP,Liberty Broadband Corporation Series A Cumulative Redeemable Preferred Stock,$24.61,0.01,0.041%,3531278638.00,United States,,12835,Telecommunications,Cable & Other Pay Television Services
LBRT,Liberty Energy Inc. Class A common stock,$18.30,-0.24,-1.294%,2963995222.00,United States,2018,1213720,Energy,Oilfield Services/Equipment
LBRX,LB Pharmaceuticals Inc Common Stock,$21.53,-0.47,-2.136%,544689666.00,United States,2025,155732,Health Care,Biotechnology: Pharmaceutical Preparations
LBTYA,Liberty Global Ltd. Class A Common Shares,$11.10,-0.04,-0.359%,3738247344.00,United Kingdom,,821878,Telecommunications,Cable & Other Pay Television Services
LBTYB,Liberty Global Ltd. Class B Common Shares,$11.1245,-0.3755,-3.265%,3746498430.00,United Kingdom,,493,Telecommunications,Cable & Other Pay Television Services
LBTYK,Liberty Global Ltd. Class C Common Shares,$11.00,-0.03,-0.272%,3704569440.00,United Kingdom,,390588,Telecommunications,Cable & Other Pay Television Services
LC,LendingClub Corporation Common Stock,$19.64,-0.11,-0.557%,2264520282.00,United States,2014,557937,Finance,Finance: Consumer Services
LCCC,Lakeshore Acquisition III Corp. Ordinary Shares,$10.20,0.01,0.098%,0.00,United States,2025,49880,Finance,Blank Checks
LCCCU,Lakeshore Acquisition III Corp. Unit,$10.29,0.00,0.00%,0.00,United States,2025,262,Finance,Blank Checks
LCFY,Locafy Limited Ordinary Share,$3.12,0.00,0.00%,5613052.00,Australia,2022,4952,Technology,Computer Software: Programming Data Processing
LCFYW,Locafy Limited Warrant,$3.00,0.00,0.00%,5397165.00,Australia,2022,4,Technology,Computer Software: Programming Data Processing
