Symbol,Name,Last Sale,Net Change,% Change,Market Cap,Country,IPO Year,Volume,Sector,Industry
A,Agilent Technologies Inc. Common Stock,$138.39,0.07,0.051%,39233408758.00,United States,1999,739316,Industrials,Biotechnology: Laboratory Analytical Instruments
AA,Alcoa Corporation Common Stock ,$54.25,0.62,1.156%,14048798736.00,United States,2016,3144379,Industrials,Aluminum
AACB,Artius II Acquisition Inc. Class A Ordinary Shares,$10.29,0.00,0.00%,0.00,United States,2025,8,,
AACBR,Artius II Acquisition Inc. Rights,$0.33,-0.0199,-5.687%,0.00,United States,2025,315,,
AACG,ATA Creativity Global American Depositary Shares,$0.744,-0.0671,-8.273%,23742072.00,China,2008,28359,Real Estate,Other Consumer Services
AAL,American Airlines Group Inc. Common Stock,$15.44,-0.24,-1.531%,10191735483.00,United States,,37771090,Consumer Discretionary,Air Freight/Delivery Services
AAM,AA Mission Acquisition Corp. Class A Ordinary Shares,$10.64,0.00,0.00%,0.00,,2024,6529,,
AAME,Atlantic American Corporation Common Stock,$2.55,-0.07,-2.672%,52012931.00,United States,,24879,Finance,Life Insurance
AAMI,Acadian Asset Management Inc. Common Stock,$48.38,-0.03,-0.062%,1727607226.00,United Kingdom,2014,106199,Finance,Investment Managers
AAOI,Applied Optoelectronics Inc. Common Stock,$37.17,-3.83,-9.341%,2537908760.00,United States,2013,3814417,Technology,Semiconductors
AAON,AAON Inc. Common Stock,$75.77,-0.02,-0.026%,6185412575.00,United States,,358409,Industrials,Industrial Machinery/Components
AAP,Advance Auto Parts Inc.,$41.25,0.13,0.316%,2475917606.00,United States,,1466895,Consumer Discretionary,Auto & Home Supply Stores
AAPG,Ascentage Pharma Group International American Depository Shares,$27.68,-0.20,-0.717%,2410004734.00,China,2025,3887,Health Care,Biotechnology: Pharmaceutical Preparations
AAPL,Apple Inc. Common Stock,$273.40,-0.41,-0.15%,4039854910200.00,United States,1980,21501388,Technology,Computer Manufacturing
AARD,Aardvark Therapeutics Inc. Common Stock,$13.65,-0.61,-4.278%,297205163.00,United States,2025,85642,Health Care,Biotechnology: Pharmaceutical Preparations
AAT,American Assets Trust Inc. Common Stock,$18.90,0.06,0.318%,1155783044.00,United States,2011,314714,Real Estate,Real Estate Investment Trusts
AAUC,Allied Gold Corporation Common Shares,$24.92,0.46,1.881%,3090080000.00,,2025,169912,,
AB,AllianceBernstein Holding L.P.  Units,$39.17,0.15,0.384%,3564205642.00,United States,,121369,Finance,Investment Managers
ABAT,American Battery Technology Company Common Stock,$3.82,-0.15,-3.778%,496485240.00,United States,,3568395,Basic Materials,Metal Mining
ABBV,AbbVie Inc. Common Stock,$229.98,0.09,0.039%,406463117667.00,United States,2012,1593952,Health Care,Biotechnology: Pharmaceutical Preparations
ABCB,Ameris Bancorp Common Stock,$76.00,-0.59,-0.77%,5191950944.00,United States,1994,285935,Finance,Major Banks
ABCL,AbCellera Biologics Inc. Common Shares,$3.58,-0.14,-3.763%,1054902605.00,Canada,2020,2611338,Health Care,Biotechnology: Pharmaceutical Preparations
ABEO,Abeona Therapeutics Inc. Common Stock,$5.45,0.04,0.739%,295342917.00,United States,,521713,Health Care,Biotechnology: Pharmaceutical Preparations
ABEV,Ambev S.A. American Depositary Shares (Each representing 1 Common Share),$2.43,0.06,2.532%,38045438917.00,Brazil,2013,31251958,Consumer Staples,Beverages (Production/Distribution)
ABG,Asbury Automotive Group Inc Common Stock,$241.46,0.57,0.237%,4694117135.00,United States,2002,140071,Consumer Discretionary,Retail-Auto Dealers and Gas Stations
ABL,Abacus Global Management Inc. Class A Common Stock,$8.50,-0.02,-0.235%,830899268.00,United States,2020,403897,Finance,Investment Managers
ABLLL,Abacus Global Management Inc. 9.875% Fixed Rate Senior Notes due 2028,$25.40,-0.04,-0.157%,1896144214.00,United States,,2924,Finance,Investment Managers
ABLV,Able View Global Inc. Class B Ordinary Shares,$0.6601,-0.0759,-10.313%,32602288.00,China,,11842,Consumer Discretionary,Other Consumer Services
ABLVW,Able View Global Inc. Warrant,$0.0291,0.0068,30.493%,1437247.00,China,,2959,Consumer Discretionary,Other Consumer Services
ABM,ABM Industries Incorporated Common Stock,$42.67,0.50,1.186%,2567779259.00,United States,,589762,Consumer Discretionary,Diversified Commercial Services
ABNB,Airbnb Inc. Class A Common Stock,$136.82,0.04,0.029%,84219517616.00,United States,2020,1775948,Consumer Discretionary,Diversified Commercial Services
ABOS,Acumen Pharmaceuticals Inc. Common Stock,$2.11,-0.05,-2.315%,127809927.00,United States,2021,92837,Health Care,Biotechnology: Biological Products (No Diagnostic Substances)
ABP,Abpro Holdings Inc Common Stock,$4.60,-0.13,-2.748%,12494879.00,United States,2022,6963,Health Care,Biotechnology: Pharmaceutical Preparations
ABPWW,Abpro Holdings Inc. Warrant,$0.014,0.00,0.00%,38028.00,United States,2022,755,Health Care,Biotechnology: Pharmaceutical Preparations
ABR,Arbor Realty Trust Common Stock,$7.97,0.04,0.504%,1559813761.00,United States,2004,2915259,Real Estate,Real Estate Investment Trusts
ABR^D,Arbor Realty Trust 6.375% Series D Cumulative Redeemable Preferred Stock Liquidation Preference $25.00 per Share,$17.10,0.04,0.234%,,United States,,37894,,
ABR^E,Arbor Realty Trust 6.25% Series E Cumulative Redeemable Preferred Stock,$17.15,0.13,0.764%,,United States,,11876,,
ABR^F,Arbor Realty Trust 6.25% Series F Fixed-to-Floating Rate Cumulative Redeemable Preferred Stock Liquidation Preference $25.00 per share,$21.89,0.15,0.69%,,United States,,15451,,
ABSI,Absci Corporation Common Stock,$3.57,0.01,0.281%,536826366.00,United States,2021,1832431,Health Care,Biotechnology: Commercial Physical & Biological Resarch
ABT,Abbott Laboratories Common Stock,$124.84,0.03,0.024%,217080773863.00,United States,,2120703,Health Care,Biotechnology: Pharmaceutical Preparations
ABTC,American Bitcoin Corp. Class A Common Stock,$1.89,0.01,0.532%,1753173439.00,United States,2018,6353782,Technology,EDP Services
ABTS,Abits Group Inc Ordinary Shares,$5.31,0.06,1.143%,12585438.00,China,,7007,Technology,Computer Software: Programming Data Processing
ABUS,Arbutus Biopharma Corporation Common Stock,$4.78,-0.01,-0.209%,919308801.00,Canada,,600277,Health Care,Biotechnology: Pharmaceutical Preparations
ABVC,ABVC BioPharma Inc. Common Stock,$2.43,0.10,4.292%,59051646.00,United States,,92851,Health Care,Biotechnology: Pharmaceutical Preparations
ABVE,Above Food Ingredients Inc. Common Stock,$1.685,-0.135,-7.418%,86258264.00,Canada,,744375,Consumer Staples,Packaged Foods
ABVEW,Above Food Ingredients Inc. Warrants,$0.2701,-0.1109,-29.108%,13826918.00,Canada,,44387,Consumer Staples,Packaged Foods
ABVX,Abivax SA American Depositary Shares,$142.31,-3.00,-2.065%,11057809048.00,France,2023,662585,Health Care,Biotechnology: Pharmaceutical Preparations
ACA,Arcosa Inc. Common Stock ,$110.28,-0.60,-0.541%,5408685357.00,United States,2018,74504,Industrials,Metal Fabrications
ACAD,ACADIA Pharmaceuticals Inc. Common Stock,$27.62,-0.25,-0.897%,4672801786.00,United States,1985,626446,Health Care,Biotechnology: Pharmaceutical Preparations
ACB,Aurora Cannabis Inc. Common Shares,$4.49,-0.08,-1.751%,254599990.00,Canada,,766859,Health Care, Medicinal Chemicals and Botanical Products 
ACCL,Acco Group Holdings Limited Ordinary Shares,$2.90,0.04,1.399%,40310000.00,Hong Kong,2025,11407,Consumer Discretionary,Professional Services
ACCO,Acco Brands Corporation Common Stock,$3.73,0.04,1.084%,336207776.00,United States,,457111,Consumer Discretionary,Publishing
ACCS,ACCESS Newswire Inc. Common Stock,$8.58,-0.295,-3.324%,33194527.00,United States,,6014,Consumer Discretionary,Publishing
ACDC,ProFrac Holding Corp. Class A Common Stock,$3.75,-0.03,-0.794%,678266936.00,United States,2022,558674,Energy,Oilfield Services/Equipment
ACEL,Accel Entertainment Inc. ,$11.70,0.22,1.916%,973532968.00,United States,2017,418462,Consumer Discretionary,Services-Misc. Amusement & Recreation
ACET,Adicet Bio Inc. Common Stock,$0.52,0.0008,0.154%,79692902.00,United States,2018,2941146,Health Care,Biotechnology: Pharmaceutical Preparations
ACFN,Acorn Energy Inc. Common Stock,$15.20,-0.57,-3.614%,38070315.00,United States,,187608,Consumer Discretionary,Military/Government/Technical
ACGL,Arch Capital Group Ltd. Common Stock,$95.87,-0.53,-0.55%,34764948676.00,Bermuda,,1324043,Finance,Property-Casualty Insurers
ACGLN,Arch Capital Group Ltd. Depositary Shares each Representing a 1/1000th Interest in a 4.550% Non-Cumulative Preferred Share Series G,$16.695,-0.015,-0.09%,6054040035.00,Bermuda,,62520,Finance,Property-Casualty Insurers
ACGLO,Arch Capital Group Ltd. Depositary Shares Each Representing 1/1000th Interest in a Share of 5.45% Non-Cumulative Preferred Shares Series F,$20.23,0.06,0.297%,7335922726.00,Bermuda,,25563,Finance,Property-Casualty Insurers
ACHC,Acadia Healthcare Company Inc. Common Stock,$14.69,0.39,2.727%,1355272459.00,United States,,1807802,Health Care,Medical Specialities
ACHR,Archer Aviation Inc. Class A Common Stock,$7.89,-0.24,-2.952%,5150709064.00,United States,2020,18000779,Industrials,Aerospace
ACHV,Achieve Life Sciences Inc. Common Shares,$4.485,0.025,0.561%,238754436.00,United States,,226683,Health Care,Biotechnology: In Vitro & In Vivo Diagnostic Substances
ACI,Albertsons Companies Inc. Class A Common Stock,$17.41,0.13,0.752%,9563444097.00,United States,2020,5364048,Consumer Staples,Food Chains
ACIC,American Coastal Insurance Corporation Common Stock,$12.54,-0.14,-1.104%,611516887.00,United States,,102976,Finance,Property-Casualty Insurers
ACIU,AC Immune SA Common Stock,$3.13,0.00,0.00%,314284480.00,Switzerland,2016,242722,Health Care,Biotechnology: Pharmaceutical Preparations
ACIW,ACI Worldwide Inc. Common Stock,$48.73,-0.14,-0.286%,5023478532.00,United States,,279147,Technology,Computer Software: Prepackaged Software
ACLS,Axcelis Technologies Inc. Common Stock,$82.61,-0.19,-0.229%,2560881995.00,United States,2000,211428,Technology,Industrial Machinery/Components
ACLX,Arcellx Inc. Common Stock,$65.71,-0.29,-0.439%,3799540853.00,United States,2022,436063,Health Care,Biotechnology: Biological Products (No Diagnostic Substances)
ACM,AECOM Common Stock,$97.40,-0.09,-0.092%,12840566537.00,United States,2007,664454,Consumer Discretionary,Military/Government/Technical
ACMR,ACM Research Inc. Class A Common Stock,$40.62,0.52,1.297%,2635281440.00,United States,2017,919637,Technology,Industrial Machinery/Components
ACN,Accenture plc Class A Ordinary Shares (Ireland),$271.09,1.11,0.411%,179036657811.00,Ireland,2001,1411911,Real Estate,Real Estate
ACNB,ACNB Corporation Common Stock,$49.40,-0.31,-0.624%,513009713.00,United States,,12339,Finance,Major Banks
ACNT,Ascent Industries Co. Common Stock,$15.93,0.00,0.00%,149181487.00,United States,,24065,Industrials,Steel/Iron Ore
ACOG,Alpha Cognition Inc. Common Stock,$6.265,0.015,0.24%,101809934.00,Canada,,56959,,
ACON,Aclarion Inc. Common Stock,$5.39,-0.49,-8.333%,3618690.00,United States,2022,95729,Health Care,Medical Specialities
ACONW,Aclarion Inc. Warrant,$0.0391,0.00,0.00%,26251.00,United States,2022,5,Health Care,Medical Specialities
ACP,abrdn Income Credit Strategies Fund Common Shares,$5.49,0.02,0.366%,0.00,United States,2011,869895,Finance,Investment Managers
ACP^A,abrdn Income Credit Strategies Fund 5.250% Series A Perpetual Preferred Stock,$19.86,-0.09,-0.451%,,United States,,4271,,
ACR,ACRES Commercial Realty Corp. Common Stock,$21.65,-0.53,-2.39%,157734972.00,United States,,18248,Real Estate,Real Estate Investment Trusts
ACR^C,ACRES Commercial Realty Corp. 8.625% Fixed-to-Floating Series C Cumulative Redeemable Preferred Stock ,$25.2495,0.0095,0.038%,,United States,,6962,,
ACR^D,ACRES Commercial Realty Corp. 7.875% Series D Cumulative Redeemable Preferred Stock,$22.344,0.044,0.197%,,United States,,5237,,
ACRE,Ares Commercial Real Estate Corporation Common Stock,$5.04,-0.05,-0.982%,277333323.00,United States,2012,354963,Real Estate,Real Estate Investment Trusts
ACRS,Aclaris Therapeutics Inc. Common Stock,$3.03,-0.01,-0.329%,328286074.00,United States,2015,498215,Health Care,Biotechnology: Pharmaceutical Preparations
ACRV,Acrivon Therapeutics Inc. Common Stock,$2.44,0.05,2.092%,76994507.00,United States,2022,180927,Health Care,Biotechnology: Pharmaceutical Preparations
ACT,Enact Holdings Inc. Common Stock,$40.09,-0.17,-0.422%,5788826299.00,United States,2021,124144,Finance,Specialty Insurers
ACTG,Acacia Research Corporation (Acacia Tech) Common Stock,$3.73,-0.07,-1.842%,359797210.00,United States,,253835,Miscellaneous,Multi-Sector Companies
ACTU,Actuate Therapeutics Inc. Common stock,$6.465,-0.095,-1.448%,253542870.00,United States,2024,13567,Health Care,Biotechnology: Pharmaceutical Preparations
ACU,Acme United Corporation. Common Stock,$40.58,-0.50,-1.217%,154476860.00,United States,1988,3998,Consumer Discretionary,Industrial Machinery/Components
ACV,Virtus Diversified Income & Convertible Fund Common Shares of Beneficial Interest,$26.83,0.16,0.60%,278038056.00,United States,2015,26800,Finance,Finance/Investors Services
ACVA,ACV Auctions Inc. Class A Common Stock,$8.26,0.00,0.00%,1422134319.00,United States,2025,1266108,Real Estate,Real Estate
ACXP,Acurx Pharmaceuticals Inc. Common Stock,$3.19,-0.27,-7.803%,6652308.00,United States,2021,47132,Health Care,Biotechnology: Pharmaceutical Preparations
AD,Array Digital Infrastructure Inc. Common Shares,$53.54,-0.31,-0.576%,4625856000.00,United States,1988,117195,Telecommunications,Telecommunications Equipment
ADACU,American Drive Acquisition Company Units,$9.98,0.01,0.10%,0.00,United States,2025,11120,Finance,Blank Checks
ADAG,Adagene Inc. American Depositary Shares,$1.78,-0.07,-3.784%,83855008.00,China,2021,14664,Health Care,Biotechnology: Pharmaceutical Preparations
ADAM,Adamas Trust Inc. Common Stock,$7.29,0.00,0.00%,658343687.00,United States,,463446,Technology,Computer Software: Prepackaged Software
ADAMG,Adamas Trust Inc. 9.125% Senior Notes Due 2030,$25.00,0.01,0.04%,0.00,United States,,11971,Real Estate,Real Estate Investment Trusts
ADAMH,Adamas Trust Inc. 9.875% Senior Notes Due 2030,$25.77,0.05,0.194%,0.00,United States,,16650,Real Estate,Real Estate Investment Trusts
ADAMI,Adamas Trust Inc. 9.125% Senior Notes Due 2029,$25.11,0.00,0.00%,2274449964.00,United States,,1741,Real Estate,Real Estate Investment Trusts
ADAML,Adamas Trust Inc. 6.875% Series F Fixed-to-Floating Rate Cumulative Redeemable Preferred Stock $0.01 par value per share,$23.138,0.053,0.23%,2089541321.00,United States,,5574,Real Estate,Real Estate Investment Trusts
ADAMM,Adamas Trust Inc. 7.875% Series E Fixed-to-Floating Rate Cumulative Redeemable Preferred Stock,$25.1112,-0.0278,-0.111%,2267736625.00,United States,,18692,Real Estate,Real Estate Investment Trusts
ADAMN,Adamas Trust Inc. 8.00% Series D Fixed-to-Floating Rate Cumulative Redeemable Preferred Stock,$22.55,0.06,0.267%,2036440349.00,United States,,9160,Real Estate,Real Estate Investment Trusts
ADAMZ,Adamas Trust Inc. 7.000% Series G Cumulative Redeemable Preferred Stock $0.01 par value per share,$19.28,-0.16,-0.823%,1741133921.00,United States,,9054,Real Estate,Real Estate Investment Trusts
ADBE,Adobe Inc. Common Stock,$353.80,0.82,0.232%,148100680000.00,United States,1986,1453138,Technology,Computer Software: Prepackaged Software
ADC,Agree Realty Corporation Common Stock,$72.40,0.00,0.00%,8321249836.00,United States,,642750,Real Estate,Real Estate Investment Trusts
ADC^A,Agree Realty Corporation Depositary Shares each representing 1/1000th of a 4.250% Series A Cumulative Redeemable Preferred Stock,$17.31,-0.05,-0.288%,,United States,,10238,,
ADCT,ADC Therapeutics SA Common Shares,$3.51,-0.02,-0.567%,434808660.00,Switzerland,2020,549148,Health Care,Biotechnology: Pharmaceutical Preparations
ADEA,Adeia Inc. Common Stock,$16.94,-0.41,-2.363%,1855102636.00,United States,2003,728613,Technology,Computer Software: Prepackaged Software
ADGM,Adagio Medical Holdings Inc Common Stock,$1.04,-0.02,-1.887%,28944588.00,United States,,100679,Health Care,Medical/Dental Instruments
ADI,Analog Devices Inc. Common Stock,$276.84,-0.72,-0.259%,135555840213.00,United States,,1746303,Technology,Semiconductors
ADIL,Adial Pharmaceuticals Inc Common Stock,$0.2325,-0.0069,-2.882%,9409996.00,United States,2018,284319,Health Care,Biotechnology: Pharmaceutical Preparations
ADM,Archer-Daniels-Midland Company Common Stock,$57.91,0.13,0.225%,27829793354.00,United States,,1141830,Consumer Staples,Packaged Foods
ADMA,ADMA Biologics Inc Common Stock,$19.28,-0.26,-1.331%,4588596909.00,United States,,1116052,Health Care,Biotechnology: Biological Products (No Diagnostic Substances)
ADNT,Adient plc Ordinary Shares ,$19.52,0.15,0.774%,1545037221.00,United States,2016,846713,Consumer Discretionary,Auto Parts:O.E.M.
ADP,Automatic Data Processing Inc. Common Stock,$258.84,0.74,0.287%,104687512897.00,United States,,1230476,Industrials,Diversified Commercial Services
ADPT,Adaptive Biotechnologies Corporation Common Stock,$16.70,0.02,0.12%,2549508640.00,United States,2019,909652,Health Care,Biotechnology: Biological Products (No Diagnostic Substances)
ADSE,ADS-TEC ENERGY PLC Ordinary Shares,$12.51,0.11,0.887%,752132925.00,Ireland,,21179,Consumer Discretionary,Industrial Specialties
ADSEW,ADS-TEC ENERGY PLC Warrant,$0.80,0.00,0.00%,48098029.00,Ireland,,4697,Consumer Discretionary,Industrial Specialties
ADSK,Autodesk Inc. Common Stock,$300.71,2.50,0.838%,63750520000.00,United States,,439323,Technology,Computer Software: Prepackaged Software
ADT,ADT Inc. Common Stock,$8.14,0.06,0.743%,6672868671.00,United States,2018,2351266,Consumer Discretionary,Diversified Commercial Services
ADTN,ADTRAN Holdings Inc. Common Stock,$8.75,-0.06,-0.681%,701014956.00,United States,1994,329044,Utilities,Telecommunications Equipment
ADTX,Aditxt Inc. Common Stock,$1.12,-0.02,-1.754%,626577.00,United States,2020,319446,Health Care,Biotechnology: Pharmaceutical Preparations
ADUR,Aduro Clean Technologies Inc. Common Stock,$11.34,0.09,0.80%,353734358.00,Canada,,169644,Industrials,Major Chemicals
ADUS,Addus HomeCare Corporation Common Stock,$110.16,-0.87,-0.784%,2036117133.00,United States,2009,209499,Health Care,Medical/Nursing Services
ADV,Advantage Solutions Inc. Class A Common Stock,$0.8894,0.0071,0.805%,290186241.00,United States,2019,452015,Real Estate,Real Estate
ADVB,Advanced Biomed Inc. Common Stock,$0.3666,-0.0084,-2.24%,7933224.00,Taiwan,2025,150596,Health Care,Medical Specialities
ADX,Adams Diversified Equity Fund Inc.,$23.38,0.09,0.386%,0.00,United States,,179722,Finance,Investment Managers
ADXN,Addex Therapeutics Ltd American Depositary Shares,$7.99,-0.21,-2.561%,12934747.00,Switzerland,,3098,Health Care,Biotechnology: Pharmaceutical Preparations
AEAQU,Activate Energy Acquisition Corp. Unit,$10.02,0.01,0.10%,0.00,Cayman Islands,2025,414,,
AEBI,Aebi Schmidt Holding AG Common Stock ,$12.87,-0.24,-1.831%,998704072.00,Switzerland,,206492,Industrials,Auto Manufacturing
AEC,Anfield Energy Inc. Common Shares,$5.26,0.22,4.365%,83517033.00,Canada,,64551,Basic Materials,Metal Mining
AEE,Ameren Corporation Common Stock,$99.81,-0.03,-0.03%,26998097566.00,United States,,632052,Utilities,Power Generation
AEF,abrdn Emerging Markets ex-China Fund Inc. Common Stock,$7.09,0.17,2.457%,761200125.00,United States,,187175,Finance,Finance/Investors Services
AEFC,Aegon Funding Company LLC 5.10% Subordinated Notes due 2049,$19.75,0.00,0.00%,0.00,United States,2019,21935,,
AEG,Aegon Ltd. New York Registry Shares,$7.70,0.02,0.26%,15447626286.00,Netherlands,,1010774,Finance,Life Insurance
AEHL,Antelope Enterprise Holdings Limited Class A Ordinary Shares,$1.29,-0.18,-12.245%,4410237.00,China,,159140,Industrials,Building Materials
AEHR,Aehr Test Systems Common Stock,$21.46,-0.61,-2.764%,643941421.00,United States,1997,347893,Industrials,Electrical Products
AEI,Alset Inc. Common Stock (TX),$2.56,0.23,9.871%,99597453.00,United States,2020,20056,Finance,Real Estate
AEIS,Advanced Energy Industries Inc. Common Stock,$217.86,0.63,0.29%,8223232234.00,United States,1995,95998,Technology,Industrial Machinery/Components
AEM,Agnico Eagle Mines Limited Common Stock,$183.21,1.87,1.031%,92102308888.00,Canada,,1425780,Basic Materials,Precious Metals
AEMD,Aethlon Medical Inc. Common Stock,$2.56,0.07,2.811%,2487992.00,United States,,37729,Health Care,Medical/Dental Instruments
AENT,Alliance Entertainment Holding Corporation Class A Common Stock,$7.73,-0.205,-2.583%,393900470.00,United States,,15512,Consumer Discretionary,Durable Goods
AENTW,Alliance Entertainment Holding Corporation Warrants,$0.9406,0.0114,1.227%,47930502.00,United States,,4727,Consumer Discretionary,Durable Goods
AEO,American Eagle Outfitters Inc. Common Stock,$26.36,-0.29,-1.088%,4468336478.00,United States,,3597723,Consumer Discretionary,Clothing/Shoe/Accessory Stores
AEON,AEON Biopharma Inc. Class A Common Stock,$1.02,-0.03,-2.857%,12075216.00,United States,,131287,Health Care,Biotechnology: Pharmaceutical Preparations
AEP,American Electric Power Company Inc. Common Stock,$115.67,0.36,0.312%,61914172183.00,United States,,1895943,Utilities,Electric Utilities: Central
AER,AerCap Holdings N.V. Ordinary Shares,$144.78,-0.46,-0.317%,27042475316.00,Netherlands,2006,375447,Consumer Discretionary,Diversified Commercial Services
AERO,Grupo Aeromexico S.A.B. de C.V. American Depositary Shares (each representing ten (10) Common Shares),$22.91,0.73,3.291%,3342647100.00,,2025,573027,Consumer Discretionary,Air Freight/Delivery Services
AERT,Aeries Technology Inc. Class A Ordinary Share,$0.5351,-0.0024,-0.447%,29398240.00,United States,2021,31920,Consumer Discretionary,Professional Services
AERTW,Aeries Technology Inc. Warrant,$0.0374,-0.0001,-0.267%,2054745.00,United States,2021,2955,Consumer Discretionary,Professional Services
AES,The AES Corporation Common Stock,$14.07,0.11,0.788%,10019541682.00,United States,,3075637,Utilities,Electric Utilities: Central
AESI,Atlas Energy Solutions Inc. Common Stock,$9.42,-0.18,-1.875%,1167912041.00,United States,2023,1200580,Industrials,Mining & Quarrying of Nonmetallic Minerals (No Fuels)
AEVA,Aeva Technologies Inc. Common Stock,$13.22,-0.27,-2.001%,794256384.00,United States,,846474,Consumer Discretionary,Auto Parts:O.E.M.
AEVAW,Aeva Technologies Inc. Warrants,$0.12,0.008,7.143%,7209589.00,United States,,16626,Consumer Discretionary,Auto Parts:O.E.M.
AEXA,American Exceptionalism Acquisition Corp. A Class A Ordinary Shares,$11.40,0.24,2.151%,0.00,,2025,578500,,
AEYE,AudioEye Inc. Common Stock,$10.69,-0.07,-0.651%,132755016.00,United States,,115986,Technology,Computer Software: Prepackaged Software
AFB,AllianceBernstein National Municipal Income Fund Inc,$10.73,0.02,0.187%,0.00,United States,2002,111118,Finance,Trusts Except Educational Religious and Charitable
AFBI,Affinity Bancshares Inc. Common Stock (MD),$21.12,0.00,0.00%,130259754.00,United States,2017,1688,Finance,Banks
AFCG,Advanced Flower Capital Inc. Common Stock,$3.10,0.18,6.164%,70043077.00,United States,2021,358045,Finance,Real Estate
AFG,American Financial Group Inc. Common Stock,$138.16,0.07,0.051%,11523037508.00,United States,,225679,Finance,Property-Casualty Insurers
AFGB,American Financial Group Inc. 5.875% Subordinated Debentures due 2059,$21.55,0.02,0.093%,1797346977.00,United States,2019,3261,Finance,Property-Casualty Insurers
AFGC,American Financial Group Inc. 5.125% Subordinated Debentures due 2059,$18.95,0.06,0.318%,1580497689.00,United States,2019,11957,Finance,Property-Casualty Insurers
AFGD,American Financial Group Inc. 5.625% Subordinated Debentures due 2060,$20.90,0.12,0.577%,1743134655.00,United States,2020,5966,Finance,Property-Casualty Insurers
AFGE,American Financial Group Inc. 4.500% Subordinated Debentures due 2060,$16.88,-0.09,-0.53%,1407852295.00,United States,2020,14368,Finance,Property-Casualty Insurers
AFJK,Aimei Health Technology Co. Ltd Ordinary Share,$44.02,-3.98,-8.292%,0.00,United States,2024,191404,,
AFJKR,Aimei Health Technology Co. Ltd Right,$0.38,-0.015,-3.797%,0.00,United States,2024,1984,,
AFJKU,Aimei Health Technology Co. Ltd Unit,$49.06,0.00,0.00%,0.00,United States,2023,15,,
AFL,AFLAC Incorporated Common Stock,$109.90,-0.72,-0.651%,57600119478.00,United States,,978827,Finance,Accident &Health Insurance
AFRI,Forafric Global PLC Ordinary Shares,$10.63,0.00,0.00%,285963923.00,Gibraltar,,6261,Consumer Staples,Packaged Foods
AFRIW,Forafric Global PLC Warrants,$1.24,-0.04,-3.125%,33357974.00,Gibraltar,,3864,Consumer Staples,Packaged Foods
AFRM,Affirm Holdings Inc. Class A Common Stock,$75.81,-0.18,-0.237%,25022882497.00,United States,2021,2071796,Finance,Finance: Consumer Services
AFYA,Afya Limited Class A Common Shares,$14.95,0.23,1.563%,1351312814.00,Brazil,2019,45490,Real Estate,Other Consumer Services
AG,First Majestic Silver Corp. Ordinary Shares (Canada),$17.42,0.21,1.22%,8557206358.00,Canada,,21740787,Basic Materials,Precious Metals
AGAE,Allied Gaming & Entertainment Inc. Common Stock,$0.4309,0.0029,0.678%,16380418.00,United States,2017,585904,Consumer Discretionary,Services-Misc. Amusement & Recreation
AGCC,Agencia Comercial Spirits Ltd Class A Ordinary Shares,$9.75,-0.75,-7.143%,332611500.00,Taiwan,2025,143804,Consumer Staples,Beverages (Production/Distribution)
AGCO,AGCO Corporation Common Stock,$105.45,0.17,0.161%,7869055035.00,United States,,571560,Industrials,Industrial Machinery/Components
AGD,abrdn Global Dynamic Dividend Fund Common Shares of Beneficial Interest,$12.11,-0.01,-0.083%,0.00,United States,2006,102841,Finance,Trusts Except Educational Religious and Charitable
AGEN,Agenus Inc. Common Stock,$3.31,-0.04,-1.194%,112567635.00,United States,2000,733409,Health Care,Biotechnology: Biological Products (No Diagnostic Substances)
AGH,Aureus Greenway Holdings Inc. Common Stock,$3.99,0.07,1.786%,60074625.00,United States,2025,3735,Consumer Discretionary,Hotels/Resorts
