Symbol,Name,Last Sale,Net Change,% Change,Market Cap,Country,IPO Year,Volume,Sector,Industry
DDT,Dillard's Capital Trust I,$26.18,-0.07,-0.267%,408747450.00,United States,,6055,Consumer Discretionary,Department/Specialty Retail Stores
DE,Deere & Company Common Stock,$468.93,1.49,0.319%,126819978772.00,United States,,503099,Industrials,Industrial Machinery/Components
DEA,Easterly Government Properties Inc. Common Stock,$21.31,0.01,0.047%,982569556.00,United States,2015,510233,Real Estate,Real Estate Investment Trusts
DEC,Diversified Energy Company Common Stock,$14.27,-0.16,-1.109%,1095312273.00,,2025,203628,,
DECK,Deckers Outdoor Corporation Common Stock,$103.09,2.14,2.12%,15024834834.00,United States,1993,1780763,Consumer Discretionary,Shoe Manufacturing
DEFT,Defi Technologies Inc. Common Stock,$0.821,-0.0886,-9.741%,316805817.00,Canada,,6099793,Finance,Finance: Consumer Services
DEI,Douglas Emmett Inc. Common Stock,$11.20,0.01,0.089%,1875575061.00,United States,2006,855754,Real Estate,Real Estate Investment Trusts
DELL,Dell Technologies Inc. Class C Common Stock ,$129.24,0.86,0.67%,85646004550.00,United States,2018,2730526,Technology,Computer Manufacturing
DENN,Denny's Corporation Common Stock,$6.21,0.01,0.161%,319808753.00,United States,,2649334,Consumer Discretionary,Restaurants
DEO,Diageo plc Common Stock,$86.32,0.66,0.77%,48045983476.00,United Kingdom,,884001,Consumer Staples,Beverages (Production/Distribution)
DERM,Journey Medical Corporation Common Stock,$7.92,-0.21,-2.583%,214916368.00,United States,2021,214371,Health Care,Biotechnology: Pharmaceutical Preparations
DEVS,DevvStream Corp. Common Stock,$1.29,-0.02,-1.527%,5650215.00,Canada,2024,31622,Finance,Finance/Investors Services
DFDV,DeFi Development Corp. Common Stock,$5.76,0.24,4.348%,180870981.00,United States,2023,1430981,Finance,Finance: Consumer Services
DFDVW,DeFi Development Corp. Warrant,$1.9401,-0.0599,-2.995%,60921491.00,United States,,5572,,
DFH,Dream Finders Homes Inc. Class A Common Stock,$17.86,-0.05,-0.279%,1656599263.00,United States,2022,245929,Consumer Discretionary,Homebuilding
DFIN,Donnelley Financial Solutions Inc. Common Stock ,$46.47,0.16,0.345%,1233178247.00,United States,2016,104428,Consumer Discretionary,Other Consumer Services
DFLI,Dragonfly Energy Holdings Corp. Common Stock (NV),$4.20,0.11,2.689%,50730561.00,United States,2021,537141,Miscellaneous,Industrial Machinery/Components
DFLIW,Dragonfly Energy Holdings Corp. Warrant,$0.1042,0.0241,30.087%,1258601.00,United States,2021,147566,Miscellaneous,Industrial Machinery/Components
DFP,Flaherty & Crumrine Dynamic Preferred and Income Fund Inc. Common Stock,$20.83,-0.02,-0.096%,0.00,,2013,56144,Finance,Investment Managers
DFSC,DEFSEC Technologies Inc. Common Stock,$1.82,0.02,1.111%,2541304.00,Canada,,58403,Technology,Computer Software: Prepackaged Software
DG,Dollar General Corporation Common Stock,$137.84,2.39,1.764%,30341185179.00,United States,2009,1721135,Consumer Discretionary,Department/Specialty Retail Stores
DGICA,Donegal Group Inc. Class A Common Stock,$20.12,-0.12,-0.593%,737228207.00,United States,,73093,Finance,Property-Casualty Insurers
DGICB,Donegal Group Inc. Class B Common Stock,$15.96,-0.355,-2.176%,584799314.00,United States,1986,407,Finance,Property-Casualty Insurers
DGII,Digi International Inc. Common Stock,$44.49,0.34,0.77%,1656478063.00,United States,1989,239111,Telecommunications,Computer Communications Equipment
DGLY,Digital Ally Inc. Common Stock,$0.7365,-0.0134,-1.787%,3900226.00,United States,,101038,Technology,Radio And Television Broadcasting And Communications Equipment
DGNX,Diginex Limited Ordinary Shares,$6.65,-0.65,-8.904%,1342968192.00,Hong Kong,2025,193482,Technology,EDP Services
DGX,Quest Diagnostics Incorporated Common Stock,$175.94,0.02,0.011%,19571981170.00,United States,,402681,Health Care,Medical Specialities
DGXX,Digi Power X Inc. Subordinate Voting Shares,$2.63,-0.07,-2.593%,164163477.00,Canada,,1665982,Finance,Finance: Consumer Services
DH,Definitive Healthcare Corp. Class A Common Stock,$2.63,0.01,0.382%,271687908.00,United States,2021,542322,Technology,Computer Software: Prepackaged Software
DHC,Diversified Healthcare Trust Common Shares of Beneficial Interest,$4.80,-0.09,-1.84%,1162305418.00,United States,,322865,Real Estate,Real Estate Investment Trusts
DHCNI,Diversified Healthcare Trust 5.625% Senior Notes due 2042,$16.91,0.16,0.955%,4082316777.00,United States,,24285,Real Estate,Real Estate Investment Trusts
DHCNL,Diversified Healthcare Trust 6.25% Senior Notes Due 2046,$18.17,0.08,0.442%,4386498867.00,United States,,3001,Real Estate,Real Estate Investment Trusts
DHF,BNY Mellon High Yield Strategies Fund Common Stock,$2.48,0.02,0.813%,0.00,United States,1998,1061032,Finance,Finance Companies
DHI,D.R. Horton Inc. Common Stock,$146.32,-0.31,-0.211%,42734297920.00,United States,,1143938,Consumer Discretionary,Homebuilding
DHIL,Diamond Hill Investment Group Inc. Class A Common Stock,$169.22,-0.48,-0.283%,457790189.00,United States,,30820,Finance,Investment Managers
DHR,Danaher Corporation Common Stock,$230.32,-1.15,-0.497%,162686431350.00,United States,,1140702,Industrials,Industrial Machinery/Components
DHT,DHT Holdings Inc.,$12.22,0.11,0.908%,1962018491.00,Jersey,2005,842026,Consumer Discretionary,Marine Transportation
DHX,DHI Group Inc. Common Stock,$1.62,0.01,0.621%,76394384.00,United States,2007,192748,Real Estate,Real Estate
DHY,Credit Suisse High Yield Credit Fund Common Stock,$2.01,0.01,0.50%,0.00,United States,1998,266177,Finance,Finance/Investors Services
DIAX,Nuveen Dow 30SM Dynamic Overwrite Fund Common Shares of Beneficial Interest,$15.23,0.03,0.197%,0.00,,2014,32039,Finance,Finance Companies
DIBS,1stdibs.com Inc. Common Stock,$5.91,-0.02,-0.337%,216390797.00,United States,2021,118745,Consumer Discretionary,Catalog/Specialty Distribution
DIN,Dine Brands Global Inc. Common Stock,$34.10,1.47,4.505%,491848136.00,United States,,327175,Consumer Discretionary,Restaurants
DINO,HF Sinclair Corporation Common Stock,$45.88,-0.47,-1.014%,8439544930.00,United States,1960,1260858,Energy,Natural Gas Distribution
DIOD,Diodes Incorporated Common Stock,$50.39,0.15,0.299%,2337356829.00,United States,,133681,Technology,Semiconductors
DIS,Walt Disney Company (The) Common Stock,$113.56,-0.92,-0.804%,202737401352.00,United States,,5427982,Consumer Discretionary,Services-Misc. Amusement & Recreation
DIT,AMCON Distributing Company Common Stock,$105.00,-1.50,-1.408%,68324445.00,United States,1999,1481,Consumer Discretionary,Food Distributors
DJCO,Daily Journal Corp. (S.C.) Common Stock,$517.01,-12.94,-2.442%,712143016.00,United States,,22457,Consumer Discretionary,Newspapers/Magazines
DJT,Trump Media & Technology Group Corp. Common Stock,$13.77,-0.54,-3.774%,3855567448.00,United States,2024,9136822,Technology,Computer Software: Programming Data Processing
DJTWW,Trump Media & Technology Group Corp. Warrants,$8.12,-0.33,-3.905%,2273580804.00,United States,2021,65494,Technology,Computer Software: Programming Data Processing
DK,Delek US Holdings Inc. Common Stock,$29.62,-0.09,-0.303%,1778727000.00,United States,2017,758559,Energy,Integrated oil Companies
DKI,DarkIris Inc. Class A Ordinary Shares,$0.3513,0.0345,10.89%,6147750.00,Hong Kong,2025,477193,Technology,Computer Software: Prepackaged Software
DKL,Delek Logistics Partners L.P. Common Units representing Limited Partner Interests,$44.85,-0.45,-0.993%,2398595985.00,United States,2012,52885,Energy,Natural Gas Distribution
DKNG,DraftKings Inc. Class A Common Stock,$34.88,0.42,1.219%,17362305079.00,United States,2019,5479077,Consumer Discretionary,Services-Misc. Amusement & Recreation
DKS,Dick's Sporting Goods Inc Common Stock,$210.25,0.01,0.005%,18915962487.00,United States,2002,950306,Consumer Discretionary,Other Specialty Stores
DLB,Dolby Laboratories Common Stock,$65.71,-0.47,-0.71%,6275692098.00,United States,2005,316638,Miscellaneous,Multi-Sector Companies
DLHC,DLH Holdings Corp.,$5.65,0.00,0.00%,81885648.00,United States,,10840,Consumer Discretionary,Professional Services
DLNG,Dynagas LNG Partners LP Common Units,$3.83,-0.03,-0.777%,140475905.00,Greece,,16286,Consumer Discretionary,Marine Transportation
DLNG^A,Dynagas LNG Partners LP 9.00% Series A Cumulative Redeemable Preferred Units,$26.25,0.25,0.962%,,Greece,,1299,,
DLO,DLocal Limited Class A Common Shares,$14.11,-0.04,-0.283%,4028054169.00,Uruguay,2021,1091117,Real Estate,Real Estate
DLPN,Dolphin Entertainment Inc. Common Stock,$1.38,-0.04,-2.817%,16728942.00,United States,,17914,Consumer Discretionary,Other Consumer Services
DLR,Digital Realty Trust Inc. Common Stock,$155.01,-0.18,-0.116%,53246175576.00,United States,2004,746105,Real Estate,Real Estate Investment Trusts
DLR^J,Digital Realty Trust Inc. 5.250% Series J Cumulative Redeemable Preferred Stock,$20.74,0.04,0.193%,,United States,,12587,,
DLR^K,Digital Realty Trust Inc. 5.850% Series K Cumulative Redeemable Preferred Stock par value $0.01 per share,$24.09,0.10,0.417%,,United States,,17033,,
DLR^L,Digital Realty Trust Inc. 5.200% Series L Cumulative Redeemable Preferred Stock,$20.40,0.03,0.147%,,United States,,16277,,
DLTH,Duluth Holdings Inc. Class B Common Stock,$2.11,-0.07,-3.211%,77492265.00,United States,2015,115032,Consumer Discretionary,Clothing/Shoe/Accessory Stores
DLTR,Dollar Tree Inc. Common Stock,$123.95,1.94,1.59%,24647852529.00,United States,1995,1894091,Consumer Discretionary,Department/Specialty Retail Stores
DLX,Deluxe Corporation Common Stock,$22.69,0.37,1.658%,1021223896.00,United States,,184985,Consumer Discretionary,Publishing
DLXY,Delixy Holdings Limited Ordinary Shares,$0.7101,-0.0599,-7.779%,11610135.00,Singapore,2025,40898,Energy,Oil Refining/Marketing
DLY,DoubleLine Yield Opportunities Fund Common Shares of Beneficial Interest,$14.54,0.05,0.345%,697131627.00,United States,2020,448061,Finance,Investment Managers
DMA,Destra Multi-Alternative Fund Common Stock,$9.02,-0.03,-0.331%,0.00,,2022,30051,Finance,Trusts Except Educational Religious and Charitable
DMAA,Drugs Made In America Acquisition Corp. Ordinary Shares,$10.37,0.00,0.00%,0.00,United States,2025,102,,
DMAAR,Drugs Made In America Acquisition Corp. Rights,$0.1889,0.0057,3.111%,0.00,United States,2025,1619,Finance,Blank Checks
DMAAU,Drugs Made In America Acquisition Corp. Units,$10.43,-0.07,-0.667%,0.00,United States,2025,2319,,
DMAC,DiaMedica Therapeutics Inc. Common Stock,$8.23,-0.24,-2.834%,428597323.00,United States,2018,130650,Health Care,Biotechnology: Pharmaceutical Preparations
DMB,BNY Mellon Municipal Bond Infrastructure Fund Inc. Common Stock,$10.80,0.04,0.372%,0.00,,2013,41237,Finance,Trusts Except Educational Religious and Charitable
DMII,Drugs Made In America Acquisition II Corp. Ordinary Shares,$9.90,0.00,0.00%,0.00,United States,2025,192861,Finance,Blank Checks
DMIIR,Drugs Made In America Acquisition II Corp. Right,$0.14,0.0075,5.66%,0.00,United States,2025,3100,Finance,Blank Checks
DMIIU,Drugs Made In America Acquisition II Corp. Unit,$10.01,0.00,0.00%,0.00,United States,2025,4975,,
DMLP,Dorchester Minerals L.P. Common Units Representing Limited Partnership Interests,$22.12,-0.08,-0.36%,1067410554.00,United States,,109453,Energy,Oil & Gas Production
DMO,Western Asset Mortgage Opportunity Fund Inc. Common Stock,$11.07,0.02,0.181%,0.00,United States,2010,95811,Finance,Trusts Except Educational Religious and Charitable
DMRC,Digimarc Corporation Common Stock,$6.83,-0.17,-2.429%,148600221.00,United States,,291057,Technology,EDP Services
DNA,Ginkgo Bioworks Holdings Inc. Class A Common Stock,$8.40,-0.51,-5.724%,508957840.00,United States,2021,796714,Health Care,Biotechnology: Biological Products (No Diagnostic Substances)
DNLI,Denali Therapeutics Inc. Common Stock,$16.87,-0.12,-0.706%,2627815928.00,United States,2017,677994,Health Care,Biotechnology: Biological Products (No Diagnostic Substances)
DNMX,Dynamix Corporation III Class A Ordinary Shares,$9.89,0.00,0.00%,0.00,United States,2025,2594,Finance,Blank Checks
DNMXU,Dynamix Corporation III Unit,$10.06,0.00,0.00%,0.00,United States,2025,2000,Finance,Blank Checks
DNMXW,Dynamix Corporation III Warrants,$0.37,0.02,5.714%,0.00,United States,2025,7151,Finance,Blank Checks
DNN,Denison Mines Corp Ordinary Shares (Canada),$2.69,-0.08,-2.888%,2413711555.00,Canada,,14689001,Basic Materials,Other Metals and Minerals
DNOW,DNOW Inc. Common Stock,$13.75,-0.04,-0.29%,1443914533.00,United States,2014,1199644,Consumer Discretionary,Oil and Gas Field Machinery
DNP,DNP Select Income Fund Inc. Common Stock,$10.04,-0.03,-0.298%,0.00,United States,1987,391950,Finance,Investment Managers
DNTH,Dianthus Therapeutics Inc. Common Stock,$41.83,-1.32,-3.059%,1793503707.00,United States,2018,319203,Health Care,Biotechnology: Pharmaceutical Preparations
DNUT,Krispy Kreme Inc. Common Stock,$4.28,0.04,0.943%,733164000.00,United States,2021,1483605,Consumer Staples,Food Chains
DOC,Healthpeak Properties Inc. Common Stock,$16.11,0.08,0.499%,11195641649.00,United States,,4654026,Real Estate,Real Estate Investment Trusts
DOCN,DigitalOcean Holdings Inc. Common Stock,$49.52,0.35,0.712%,4530690872.00,United States,2021,552143,Technology,Computer Software: Programming Data Processing
DOCS,Doximity Inc. Class A Common Stock,$43.69,-0.09,-0.206%,8225571743.00,United States,2021,1513869,Technology,EDP Services
DOCU,DocuSign Inc. Common Stock,$69.97,0.33,0.474%,14013083618.00,United States,1989,1271310,Technology,Computer Software: Prepackaged Software
DOGZ,Dogness (International) Corporation Class A Common Stock,$10.20,0.03,0.295%,145458712.00,China,2017,138904,Consumer Discretionary,Miscellaneous manufacturing industries
DOLE,Dole plc Ordinary Shares,$15.03,-0.08,-0.529%,1429924651.00,Ireland,2021,319176,Consumer Staples,Farming/Seeds/Milling
DOMH,Dominari Holdings Inc. Common Stock,$4.57,0.05,1.106%,73176828.00,United States,,211436,Health Care,Biotechnology: Pharmaceutical Preparations
DOMO,Domo Inc. Class B Common Stock,$8.94,0.07,0.789%,373678518.00,United States,2018,492385,Technology,Computer Software: Prepackaged Software
DOO,BRP Inc. Common Subordinate Voting Shares,$72.64,0.36,0.498%,5328459766.00,Canada,,134002,Consumer Discretionary,Industrial Specialties
DORM,Dorman Products Inc. Common Stock,$126.62,0.79,0.628%,3869841983.00,United States,,93561,Consumer Discretionary,Auto Parts:O.E.M.
DOUG,Douglas Elliman Inc. Common Stock,$2.38,-0.06,-2.459%,211389149.00,United States,2021,364066,Finance,Real Estate
DOV,Dover Corporation Common Stock,$200.15,0.59,0.296%,27451217583.00,United States,,332924,Industrials,Industrial Machinery/Components
DOW,Dow Inc. Common Stock ,$23.29,0.23,0.997%,16553772560.00,United States,2019,8928317,Industrials,Major Chemicals
DOX,Amdocs Limited Ordinary Shares,$81.73,0.38,0.467%,8822715822.00,Guernsey,,530028,Technology,EDP Services
DOYU,DouYu International Holdings Limited ADS,$6.95,-0.07,-0.997%,209743070.00,China,2019,23417,Technology,Computer Software: Programming Data Processing
DPG,Duff & Phelps Utility and Infrastructure Fund Inc.,$12.82,0.02,0.156%,0.00,United States,2011,69842,Finance,Trusts Except Educational Religious and Charitable
DPRO,Draganfly Inc. Common Shares,$7.36,-0.74,-9.136%,171201048.00,Canada,,1301263,Industrials,Aerospace
DPZ,Domino's Pizza Inc Common Stock,$425.56,0.13,0.031%,14378062932.00,United States,2004,214669,Consumer Discretionary,Food Distributors
DQ,DAQO New Energy Corp. American Depositary Shares each representing five ordinary shares,$31.82,0.40,1.273%,2133744671.00,China,2010,308497,Technology,Semiconductors
DRCT,Direct Digital Holdings Inc. Class A Common Stock,$0.0529,-0.0034,-6.039%,1587388.00,United States,2022,7426472,Consumer Discretionary,Advertising
DRD,DRDGOLD Limited American Depositary Shares,$33.33,-0.01,-0.03%,2881674170.00,South Africa,,338554,Basic Materials,Precious Metals
DRDB,Roman DBDR Acquisition Corp. II Ordinary shares,$10.42,0.00,0.00%,0.00,United States,2025,114,,
DRDBW,Roman DBDR Acquisition Corp. II Warrants,$0.60,-0.03,-4.762%,0.00,United States,2025,2672,,
DRH,Diamondrock Hospitality Company Common Stock,$9.17,-0.06,-0.65%,1867958179.00,United States,2005,1056071,Real Estate,Real Estate Investment Trusts
DRH^A,Diamondrock Hospitality Company 8.250% Series A Cumulative Redeemable Preferred Stock,$24.97,0.01,0.04%,,United States,,5607,,
DRI,Darden Restaurants Inc. Common Stock,$188.37,-1.54,-0.811%,21910023348.00,United States,,838050,Consumer Discretionary,Restaurants
DRIO,DarioHealth Corp. Common Stock,$10.04,0.00,0.00%,67952567.00,Israel,,5410,Health Care,Medical/Dental Instruments
DRMA,Dermata Therapeutics Inc. Common Stock,$1.86,-0.51,-21.519%,1909210.00,United States,2021,682274,Health Care,Biotechnology: Pharmaceutical Preparations
DRMAW,Dermata Therapeutics Inc. Warrant,$0.0258,-0.0002,-0.769%,26483.00,United States,2021,28101,Health Care,Biotechnology: Pharmaceutical Preparations
DRS,Leonardo DRS Inc. Common Stock,$34.28,-0.24,-0.695%,9119396133.00,Israel,,504553,Industrials,Industrial Machinery/Components
DRTS,Alpha Tau Medical Ltd. Ordinary Shares,$5.10,0.05,0.99%,358940907.00,Israel,,59630,Health Care,Medical/Dental Instruments
DRTSW,Alpha Tau Medical Ltd. Warrant,$0.34,0.02,6.25%,23929394.00,Israel,,1115,Health Care,Medical/Dental Instruments
DRUG,Bright Minds Biosciences Inc. Common Stock,$82.12,-2.54,-3.00%,627050993.00,Canada,,188022,Health Care,Biotechnology: Pharmaceutical Preparations
DRVN,Driven Brands Holdings Inc. Common Stock,$14.82,-0.09,-0.604%,2437211511.00,United States,2021,553049,Consumer Discretionary,Automotive Aftermarket
DSACU,Daedalus Special Acquisition Corp. Unit,$10.04,-0.005,-0.05%,0.00,Cayman Islands,2025,3822,Finance,Blank Checks
DSGN,Design Therapeutics Inc. Common Stock,$9.63,-0.11,-1.129%,548560980.00,United States,2021,111454,Health Care,Biotechnology: Pharmaceutical Preparations
DSGR,Distribution Solutions Group Inc. Common Stock,$28.72,0.04,0.139%,1327661956.00,United States,,26870,Consumer Discretionary,Industrial Specialties
DSGX,Descartes Systems Group Inc. (The) Common Stock,$89.435,0.385,0.432%,7690231515.00,Canada,,167292,Technology,Computer Software: Prepackaged Software
DSL,DoubleLine Income Solutions Fund Common Shares of Beneficial Interests,$11.28,0.05,0.445%,1150524220.00,United States,2013,536108,Finance,Trusts Except Educational Religious and Charitable
DSM,BNY Mellon Strategic Municipal Bond Fund Inc. Common Stock,$6.03,0.02,0.333%,0.00,United States,1989,135135,Finance,Investment Managers
DSP,Viant Technology Inc. Class A Common Stock,$11.98,0.05,0.419%,747954600.00,United States,2021,90625,Technology,Computer Software: Programming Data Processing
DSS,DSS Inc. Common Stock,$0.9701,-0.0199,-2.01%,8820652.00,United States,,23280,Consumer Discretionary,Containers/Packaging
DSU,Blackrock Debt Strategies Fund Inc. Common Stock,$10.21,-0.01,-0.098%,0.00,United States,1998,268212,Finance,Finance Companies
DSWL,Deswell Industries Inc. Common Shares,$3.52,0.05,1.441%,56092041.00,Macau,1995,13704,Industrials,Plastic Products
DSX,Diana Shipping inc. common stock,$1.70,0.00,0.00%,196805364.00,Greece,2005,574139,Consumer Discretionary,Marine Transportation
DSX^B,Diana Shipping Inc. Perpetual Preferred Shares Series B (Marshall Islands),$25.72,0.00,0.00%,,Greece,,346,,
DSY,Big Tree Cloud Holdings Limited Ordinary Shares,$0.3062,-0.0091,-2.886%,29100465.00,China,,65653,Consumer Discretionary,Containers/Packaging
DSYWW,Big Tree Cloud Holdings Limited Warrants,$0.02,0.00,0.00%,1900749.00,China,,15586,Consumer Discretionary,Containers/Packaging
DT,Dynatrace Inc. Common Stock,$44.33,0.58,1.326%,13364975053.00,United States,2019,1884733,Technology,Computer Software: Prepackaged Software
DTB,DTE Energy Company 2020 Series G 4.375% Junior Subordinated Debentures due 2080,$17.40,0.03,0.173%,3613684409.00,United States,2020,11948,Utilities,Electric Utilities: Central
DTCK,Davis Commodities Limited Class A Ordinary Shares,$0.3951,0.1572,66.078%,9680197.00,Singapore,2023,147377380,Industrials,Farming/Seeds/Milling
DTCX,Datacentrex Inc. Common Stock,$2.97,-0.14,-4.502%,49127786.00,United States,,236973,Technology,EDP Services
DTE,DTE Energy Company Common Stock,$129.05,0.26,0.202%,26801492699.00,United States,,735343,Utilities,Electric Utilities: Central
DTF,DTF Tax-Free Income 2028 Term Fund Inc. Common Stock,$11.34,0.01,0.088%,79715290.00,United States,1991,7392,Finance,Investment Managers
DTG,DTE Energy Company 2021 Series E 4.375% Junior Subordinated Debentures,$17.24,-0.01,-0.058%,3580455127.00,United States,2021,20468,Utilities,Electric Utilities: Central
DTI,Drilling Tools International Corporation Common Stock,$2.76,-0.04,-1.429%,97148627.00,United States,2021,27017,Consumer Discretionary,Oil and Gas Field Machinery
DTIL,Precision BioSciences Inc. Common Stock,$4.23,-0.06,-1.399%,56076057.00,United States,2019,163008,Health Care,Biotechnology: Biological Products (No Diagnostic Substances)
DTK,DTE Energy Company 2025 Series H 6.25% Junior Subordinated Debentures due 2085,$24.78,0.02,0.081%,0.00,United States,2025,50783,Utilities,Electric Utilities: Central
DTM,DT Midstream Inc. Common Stock ,$120.48,-0.07,-0.058%,12249674484.00,United States,2021,280258,Utilities,Natural Gas Distribution
DTSQ,DT Cloud Star Acquisition Corporation Ordinary Shares,$10.85,0.00,0.00%,0.00,United States,2024,3325,,
DTSQR,DT Cloud Star Acquisition Corporation Right,$0.13,0.00,0.00%,0.00,United States,2024,206,,
DTSS,Datasea Inc. Common Stock,$0.841,0.0017,0.203%,7207970.00,China,,22123,Technology,Computer Software: Prepackaged Software
DTST,Data Storage Corporation Common Stock,$5.07,0.04,0.795%,38016675.00,United States,,28860,Technology,EDP Services
DTSTW,Data Storage Corporation Warrant,$0.2387,-0.0002,-0.084%,1789858.00,United States,,87644,Technology,EDP Services
DTW,DTE Energy Company 2017 Series E 5.25% Junior Subordinated Debentures due 2077,$21.12,0.0049,0.023%,4386265213.00,United States,2017,16852,Utilities,Electric Utilities: Central
DUK,Duke Energy Corporation (Holding Company) Common Stock,$117.18,-0.30,-0.255%,91126342228.00,United States,,1440304,Utilities,Power Generation
DUK^A,Duke Energy Corporation Depositary Shares each representing a 1/1000th interest in a share of 5.75% Series A Cumulative Redeemable Perpetual Preferred Stock,$24.99,0.02,0.08%,,United States,,31395,,
DUKB,Duke Energy Corporation 5.625% Junior Subordinated Debentures due 2078,$24.63,-0.01,-0.041%,19153795947.00,United States,2018,9164,Utilities,Power Generation
DUO,Fangdd Network Group Ltd. Class A Ordinary Shares,$1.65,-0.07,-4.07%,6442532.00,China,2019,24996,Finance,Real Estate
DUOL,Duolingo Inc. Class A Common Stock,$181.66,0.97,0.537%,8397661673.00,United States,2021,677717,Technology,Computer Software: Prepackaged Software
DUOT,Duos Technologies Group Inc. Common Stock,$9.65,-0.08,-0.822%,197007529.00,United States,,69394,Technology,Computer Software: Prepackaged Software
DV,DoubleVerify Holdings Inc. Common Stock,$11.50,0.15,1.322%,1852732961.00,United States,2021,1230833,Technology,Computer Software: Programming Data Processing
DVA,DaVita Inc. Common Stock,$113.98,-0.43,-0.376%,8046988000.00,United States,,492081,Health Care,Misc Health and Biotechnology Services
DVAX,Dynavax Technologies Corporation Common Stock,$15.38,0.00,0.00%,1805996008.00,United States,2004,6095599,Health Care,Biotechnology: Pharmaceutical Preparations
DVLT,Datavault AI Inc. Common Stock,$0.7481,-0.0474,-5.959%,213370948.00,United States,2018,51170752,Technology,Semiconductors
DVN,Devon Energy Corporation Common Stock,$35.67,-0.53,-1.464%,22375791000.00,United States,1985,5208378,Energy,Oil & Gas Production
DVS,Dolly Varden Silver Corporation Common Shares,$5.00,0.08,1.626%,459333900.00,,2025,1561901,,
DWSN,Dawson Geophysical Company Common Stock,$1.70,0.00,0.00%,52781262.00,United States,,16850,Energy,Oil & Gas Production
DWTX,Dogwood Therapeutics Inc. Common Stock,$4.07,-0.31,-7.078%,126409825.00,United States,2020,33884,Health Care,Biotechnology: Pharmaceutical Preparations
DX,Dynex Capital Inc. Common Stock,$13.88,-0.07,-0.502%,2037885821.00,United States,,2951183,Real Estate,Real Estate Investment Trusts
DX^C,Dynex Capital Inc. 6.900% Series C Fixed-to-Floating Rate Cumulative Redeemable Preferred Stock,$25.9652,-0.1148,-0.44%,,United States,,22867,,
DXC,DXC Technology Company Common Stock ,$15.10,0.00,0.00%,2629422600.00,United States,,1121488,Technology,EDP Services
DXCM,DexCom Inc. Common Stock,$67.57,0.15,0.222%,26353399499.00,United States,2005,1411788,Health Care,Medical/Dental Instruments
DXF,Eason Technology Limited American Depositary Shares (each representing sixty-thousand (60000) Ordinary Shares),$2.17,-0.03,-1.364%,3011841.00,,,44715,Finance,Finance: Consumer Services
DXLG,Destination XL Group Inc. Common Stock,$0.9294,0.0036,0.389%,50797672.00,United States,,62599,Consumer Discretionary,Clothing/Shoe/Accessory Stores
DXPE,DXP Enterprises Inc. Common Stock,$115.79,0.79,0.687%,1815504989.00,United States,,112555,Industrials,Industrial Machinery/Components
DXR,Daxor Corporation Common Stock,$13.91,0.0868,0.628%,67324400.00,United States,,9065,Health Care,Medical/Dental Instruments
DXST,Decent Holding Inc Class A Ordinary Shares,$1.29,0.00,0.00%,20962500.00,China,2025,10493,Industrials,Miscellaneous
DXYZ,Destiny Tech100 Inc. Common Stock,$30.98,0.10,0.324%,0.00,,2024,1026191,,
DY,Dycom Industries Inc. Common Stock,$347.63,-0.77,-0.221%,10065992009.00,United States,,205574,Industrials,Water Sewer Pipeline Comm & Power Line Construction
DYAI,Dyadic International Inc. Common Stock,$0.9519,-0.0326,-3.311%,34447165.00,United States,,57284,Health Care,Biotechnology: Biological Products (No Diagnostic Substances)
DYN,Dyne Therapeutics Inc. Common Stock,$20.04,-0.31,-1.523%,3238338269.00,United States,2020,964713,Health Care,Biotechnology: Pharmaceutical Preparations
