Symbol,Name,Last Sale,Net Change,% Change,Market Cap,Country,IPO Year,Volume,Sector,Industry
PSA^P,Public Storage Depositary Shares Each Representing 1/1000 of a 4.000% Cumulative Preferred Share of Bene cial Interest Series P,$15.95,0.00,0.00%,,United States,,49264,,
PSA^Q,Public Storage Depositary Shares Each Representing 1/1000 of a 3.950% Cumulative Preferred Share of Beneficial Interest Series Q par value $0.01 per share,$15.72,0.04,0.255%,,United States,,4168,,
PSA^R,Public Storage Depositary Shares Each Representing 1/1000 of a 4.00% Cumulative Preferred Share of Bene cial Interest Series R,$16.06,-0.02,-0.124%,,United States,,46211,,
PSA^S,Public Storage Depositary Shares Each Representing 1/1000 of a 4.100% Cumulative Preferred Share of Beneficial Interest Series S,$16.33,0.068,0.418%,,United States,,25478,,
PSBD,Palmer Square Capital BDC Inc. Common Stock,$12.23,0.06,0.493%,0.00,,2024,199840,,
PSEC,Prospect Capital Corporation Common Stock,$2.51,0.02,0.803%,1181986585.00,United States,2004,4242053,Finance,Finance: Consumer Services
PSEC^A,Prospect Capital Corporation 5.35% Series A Fixed Rate Cumulative Perpetual Preferred Stock,$16.28,-0.165,-1.003%,,United States,,6686,,
PSF,Cohen & Steers Select Preferred and Income Fund Inc. Common Stock,$20.285,0.075,0.371%,996777069.00,,2010,69483,Finance,Investment Managers
PSFE,Paysafe Limited Common Shares,$8.03,-0.20,-2.43%,480903081.00,,2021,395589,Real Estate,Real Estate
PSHG,Performance Shipping Inc. Common Shares,$2.31,-0.01,-0.431%,28718285.00,Greece,,23201,Consumer Discretionary,Marine Transportation
PSIG,PS International Group Ltd. Ordinary Shares,$4.26,0.00,0.00%,36734415.00,Hong Kong,,805,Industrials,Integrated Freight & Logistics
PSIX,Power Solutions International Inc. Common Stock,$65.49,-1.04,-1.563%,1508950506.00,United States,,312857,Industrials,Industrial Machinery/Components
PSKY,Paramount Skydance Corporation Class B Common Stock,$13.59,-0.15,-1.092%,14992039217.00,United States,,2883498,Industrials,Broadcasting
PSMT,PriceSmart Inc. Common Stock,$124.95,0.89,0.717%,3859551936.00,United States,,84240,Consumer Discretionary,Department/Specialty Retail Stores
PSN,Parsons Corporation Common Stock,$62.56,-0.28,-0.446%,6661925690.00,United States,2019,527930,Technology,EDP Services
PSNL,Personalis Inc. Common Stock,$8.14,-0.27,-3.21%,722867393.00,United States,2019,454756,Health Care,Medical Specialities
PSNY,Polestar Automotive Holding UK PLC Class A ADS,$17.54,0.36,2.095%,1350444451.00,Sweden,,262597,Industrials,Auto Manufacturing
PSNYW,Polestar Automotive Holding UK PLC Class C-1 ADS (ADW),$7.02,-0.38,-5.135%,540485749.00,Sweden,,14610,Industrials,Auto Manufacturing
PSO,Pearson Plc Common Stock,$14.20,0.03,0.212%,9027975720.00,United Kingdom,,289243,Consumer Discretionary,Books
PSQH,PSQ Holdings Inc. Class A Common Stock,$1.09,-0.03,-2.679%,59649706.00,,2021,222686,Consumer Discretionary,Advertising
PSTG,Pure Storage Inc. Class A Common Stock,$69.28,2.29,3.418%,22874291843.00,United States,2015,2121679,Technology,Electronic Components
PSTL,Postal Realty Trust Inc. Class A Common Stock,$16.09,0.13,0.815%,419347813.00,United States,2019,126057,Real Estate,Real Estate Investment Trusts
PSTV,PLUS THERAPEUTICS Inc. Common Stock ,$0.5799,0.008,1.399%,79695109.00,United States,,1937320,Health Care,Medical/Dental Instruments
PSX,Phillips 66 Common Stock,$127.75,-0.66,-0.514%,51473174996.00,United States,,1317392,Energy,Integrated oil Companies
PT,Pintec Technology Holdings Limited American Depositary Shares,$0.935,0.0047,0.505%,14911343.00,China,2018,109975,Technology,Computer Software: Programming Data Processing
PTA,Cohen & Steers Tax-Advantaged Preferred Securities and Income Fund Common Shares of Beneficial Interest,$19.33,0.05,0.259%,1068435924.00,United States,2020,301412,Finance,Trusts Except Educational Religious and Charitable
PTC,PTC Inc. Common Stock,$176.59,0.12,0.068%,21093368410.00,United States,,239738,Technology,Computer Software: Prepackaged Software
PTCT,PTC Therapeutics Inc. Common Stock,$78.56,0.19,0.242%,6307449241.00,United States,2013,525598,Health Care,Biotechnology: Pharmaceutical Preparations
PTEN,Patterson-UTI Energy Inc. Common Stock,$5.85,-0.06,-1.015%,2218565840.00,United States,1993,5349597,Energy,Oil & Gas Production
PTGX,Protagonist Therapeutics Inc. Common Stock,$88.78,-0.06,-0.068%,5550140827.00,United States,2016,390105,Health Care,Biotechnology: Pharmaceutical Preparations
PTHL,Pheton Holdings Ltd Class A Ordinary Shares,$0.4466,-0.0259,-5.481%,6364050.00,China,2024,27368,Health Care,Biotechnology: Electromedical & Electrotherapeutic Apparatus
PTHS,Pelthos Therapeutics Inc. Common Stock,$25.71,-0.79,-2.981%,78715819.00,,2024,2162,Health Care,Biotechnology: Biological Products (No Diagnostic Substances)
PTIX,Protagenic Therapeutics Inc. Common Stock,$1.325,0.175,15.217%,2563713.00,United States,,66334,Health Care,Biotechnology: Pharmaceutical Preparations
PTIXW,Protagenic Therapeutics Inc. Warrant,$0.0211,-0.004,-15.936%,40826.00,United States,,1333,Health Care,Biotechnology: Pharmaceutical Preparations
PTLE,PTL LTD Class A Ordinary Shares,$0.11,-0.0054,-4.679%,10723625.00,Singapore,2024,312468,Energy,Oil Refining/Marketing
PTLO,Portillo's Inc. Class A Common Stock,$4.71,-0.03,-0.633%,355014597.00,United States,2021,1816985,Consumer Discretionary,Restaurants
PTN,Palatin Technologies Inc. Common Stock,$14.61,-1.39,-8.688%,24876082.00,United States,,73337,Health Care,Biotechnology: Pharmaceutical Preparations
PTON,Peloton Interactive Inc. Class A Common Stock,$6.06,-0.05,-0.818%,2531907220.00,United States,2019,4343565,Consumer Discretionary,Recreational Games/Products/Toys
PTRN,Pattern Group Inc. Series A Common Stock,$11.84,0.36,3.136%,1829545370.00,United States,2025,369860,Consumer Discretionary,Catalog/Specialty Distribution
PTY,Pimco Corporate & Income Opportunity Fund,$12.87,0.03,0.234%,0.00,United States,2002,1326346,Finance,Investment Managers
PUBM,PubMatic Inc. Class A Common Stock,$8.98,-0.03,-0.333%,416804922.00,United States,2020,273549,Technology,Computer Software: Programming Data Processing
PUK,Prudential Public Limited Company Common Stock,$31.64,0.04,0.127%,40423880379.00,United Kingdom,,220401,Finance,Life Insurance
PULM,Pulmatrix Inc. Common Stock,$2.34,0.05,2.183%,8546347.00,United States,2014,22215,Health Care,Biotechnology: Pharmaceutical Preparations
PUMP,ProPetro Holding Corp. Common Stock,$9.26,-0.09,-0.963%,962874996.00,United States,2017,1309659,Energy,Oilfield Services/Equipment
PURR,Hyperliquid Strategies Inc Common Stock,$3.26,0.05,1.558%,414103335.00,United States,,780308,Health Care,Biotechnology: Pharmaceutical Preparations
PVH,PVH Corp. Common Stock,$68.65,-0.26,-0.377%,3144355080.00,United States,,377973,Industrials,Garments and Clothing
PVL,Permianville Royalty Trust Units of Beneficial Interest,$1.79,-0.01,-0.556%,59070000.00,United States,2011,9332,Energy,Oil & Gas Production
PVLA,Palvella Therapeutics Inc. Common Stock,$103.37,-2.46,-2.324%,1223537971.00,United States,,124803,Health Care,Biotechnology: Pharmaceutical Preparations
PW,Power REIT (MD) Common Stock,$0.9539,-0.0262,-2.673%,3233398.00,United States,1998,8468,Real Estate,Real Estate Investment Trusts
PW^A,Power REIT 7.75% Series A Cumulative Perpetual Preferred Stock,$5.21,0.00,0.00%,,United States,,105,,
PWP,Perella Weinberg Partners Class A Common Stock,$17.73,0.27,1.546%,1574582187.00,United States,2020,487437,Finance,Finance: Consumer Services
PWR,Quanta Services Inc. Common Stock,$432.67,-0.91,-0.21%,64517970828.00,United States,,279207,Industrials,Engineering & Construction
PX,P10 Inc. Class A Common Stock,$10.08,0.02,0.199%,1108952107.00,United States,2021,206949,Finance,Investment Managers
PXED,Phoenix Education Partners Inc. Common Stock,$31.90,-0.34,-1.055%,1137329520.00,,2025,98645,Real Estate,Other Consumer Services
PXLW,Pixelworks Inc.  Common Stock,$6.79,0.19,2.879%,42733171.00,United States,2000,97262,Technology,Semiconductors
PXS,Pyxis Tankers Inc. Common Stock,$2.95,0.00,0.00%,30933302.00,Greece,,6586,Consumer Discretionary,Marine Transportation
PYPD,PolyPid Ltd. Ordinary Shares,$4.07,0.05,1.244%,41476979.00,Israel,2020,29203,Health Care,Biotechnology: Pharmaceutical Preparations
PYPL,PayPal Holdings Inc. Common Stock,$59.97,-0.07,-0.117%,56111047621.00,United States,,7523188,Industrials,Diversified Commercial Services
PYXS,Pyxis Oncology Inc. Common Stock,$1.11,0.00,0.00%,101015011.00,United States,2021,1611444,Health Care,Biotechnology: Pharmaceutical Preparations
PZG,Paramount Gold Nevada Corp. Common Stock,$1.24,0.06,5.085%,97164448.00,United States,2015,797393,Basic Materials,Metal Mining
PZZA,Papa John's International Inc. Common Stock,$39.30,0.02,0.051%,1288624049.00,United States,1993,566211,Consumer Discretionary,Restaurants
Q,Qnity Electronics Inc. Common Stock,$84.21,0.84,1.008%,17638895567.00,United States,2025,851163,Technology,Semiconductors
QBTS,D-Wave Quantum Inc. Common Shares,$25.29,-2.23,-8.103%,8854580398.00,,2022,33466398,Technology,EDP Services
QCLS,Q/C Technologies Inc. Common Stock,$4.76,-0.37,-7.212%,19833778.00,United States,2014,554696,Health Care,Biotechnology: In Vitro & In Vivo Diagnostic Substances
QCOM,QUALCOMM Incorporated Common Stock,$174.81,0.04,0.023%,187221510000.00,United States,1991,2441812,Technology,Radio And Television Broadcasting And Communications Equipment
QCRH,QCR Holdings Inc. Common Stock,$84.76,-0.01,-0.012%,1427244228.00,United States,,60633,Finance,Major Banks
QDEL,QuidelOrtho Corporation Common Stock,$29.30,0.39,1.349%,1990394122.00,United States,,481689,Health Care,Biotechnology: In Vitro & In Vivo Diagnostic Substances
QETA,Quetta Acquisition Corporation Common Stock,$11.225,-0.115,-1.014%,0.00,United States,2023,705,Finance,Blank Checks
QETAR,Quetta Acquisition Corporation Right,$1.99,0.03,1.531%,0.00,United States,2023,1160,Finance,Blank Checks
QFIN,Qfin Holdings Inc. American Depositary Shares,$20.00,0.20,1.01%,2692000000.00,China,2018,1037493,Finance,Finance: Consumer Services
QGEN,Qiagen N.V. Common Shares,$45.37,-0.11,-0.242%,9805187548.00,Netherlands,,719623,Health Care,Biotechnology: Biological Products (No Diagnostic Substances)
QH,Quhuo Limited American Depository Shares,$1.20,0.00,0.00%,1195933.00,China,2020,78305,Real Estate,Real Estate
QIPT,Quipt Home Medical Corp. Common Shares,$3.53,0.00,0.00%,155416976.00,United States,,229515,Health Care,Misc Health and Biotechnology Services
QLYS,Qualys Inc. Common Stock,$138.29,-1.25,-0.896%,4958845413.00,United States,2012,208727,Technology,Computer Software: Prepackaged Software
QMCO,Quantum Corporation Common Stock,$6.96,-0.41,-5.563%,95500185.00,United States,,465925,Technology,Electronic Components
QNCX,Quince Therapeutics Inc. Common Stock,$3.56,-0.10,-2.732%,198226104.00,United States,2019,388251,Health Care,Biotechnology: Biological Products (No Diagnostic Substances)
QNRX,Quoin Pharmaceuticals Ltd. American Depositary Shares,$13.99,0.09,0.647%,151711463.00,Israel,2016,11444,Health Care,Medical/Dental Instruments
QNST,QuinStreet Inc. Common Stock,$14.43,-0.22,-1.502%,818925227.00,United States,2010,311120,Real Estate,Real Estate
QNTM,Quantum Biopharma Ltd. Class B Subordinate Voting Shares,$8.30,-0.39,-4.488%,31896361.00,Canada,,64236,Health Care,Biotechnology: Pharmaceutical Preparations
QQQX,Nuveen NASDAQ 100 Dynamic Overwrite Fund Shares of Beneficial Interest,$28.525,0.01,0.035%,0.00,United States,,51273,Finance,Finance Companies
QRHC,Quest Resource Holding Corporation Common Stock,$1.97,-0.05,-2.475%,41114085.00,United States,,39288,Utilities,Environmental Services
QRVO,Qorvo Inc. Common Stock,$86.12,-0.02,-0.023%,7957222837.00,United States,,473154,Technology,Semiconductors
QS,QuantumScape Corporation Class A Common Stock,$10.92,-0.26,-2.326%,6566307308.00,United States,,10243287,Miscellaneous,Industrial Machinery/Components
QSEA,Quartzsea Acquisition Corporation Ordinary Shares,$10.23,0.00,0.00%,0.00,United States,2025,663,Finance,Blank Checks
QSEAR,Quartzsea Acquisition Corporation Rights,$0.2001,-0.0499,-19.96%,0.00,United States,2025,500,Finance,Blank Checks
QSI,Quantum-Si Incorporated Class A Common Stock,$1.23,-0.08,-6.107%,265052288.00,United States,2020,4157952,Industrials,Industrial Machinery/Components
QSIAW,Quantum-Si Incorporated Warrant,$0.25,-0.01,-3.846%,53872416.00,United States,2020,19015,Industrials,Industrial Machinery/Components
QSR,Restaurant Brands International Inc. Common Shares,$69.88,0.31,0.446%,31781088716.00,Canada,2014,1740435,Consumer Discretionary,Restaurants
QTRX,Quanterix Corporation Common Stock,$6.46,-0.16,-2.417%,301751749.00,United States,2017,352690,Industrials,Biotechnology: Laboratory Analytical Instruments
QTTB,Q32 Bio Inc. Common Stock,$3.20,0.00,0.00%,39373926.00,United States,2018,146093,Health Care,Biotechnology: Pharmaceutical Preparations
QTWO,Q2 Holdings Inc. Common Stock,$74.52,0.24,0.323%,4659735973.00,United States,2014,266047,Technology,Computer Software: Prepackaged Software
QUAD,Quad Graphics Inc Class A Common Stock,$6.37,-0.06,-0.933%,324114359.00,United States,,134945,Consumer Discretionary,Publishing
QUBT,Quantum Computing Inc. Common Stock,$10.66,-0.76,-6.655%,2389154421.00,United States,,13594791,Technology,Computer Software: Prepackaged Software
QUIK,QuickLogic Corporation Common Stock,$6.42,0.02,0.313%,109719424.00,United States,1999,101756,Technology,Semiconductors
QUMS,Quantumsphere Acquisition Corp. Ordinary Shares,$10.00,0.00,0.00%,0.00,United States,2025,3,,
QUMSR,Quantumsphere Acquisition Corp. Rights,$0.2101,0.00,0.00%,0.00,United States,2025,2023,,
QURE,uniQure N.V. Ordinary Shares,$24.81,-0.38,-1.509%,1545456159.00,Netherlands,2014,861113,Health Care,Biotechnology: Pharmaceutical Preparations
QVCC,QVC Inc. 6.250% Senior Secured Notes due 2068,$8.88,-0.0869,-0.969%,0.00,United States,2019,52908,Consumer Discretionary,Catalog/Specialty Distribution
QVCD,QVC Inc. 6.375% Senior Secured Notes due 2067,$8.90,-0.10,-1.111%,0.00,United States,2018,23786,Consumer Discretionary,Catalog/Specialty Distribution
QVCGA,QVC Group Inc. Series A Common Stock,$11.485,-0.165,-1.416%,92666355.00,United States,,19876,Consumer Discretionary,Catalog/Specialty Distribution
QVCGP,QVC Group Inc. 8.0% Fixed Rate Cumulative Redeemable Preferred Stock,$3.79,-0.03,-0.785%,30579494.00,United States,,68841,Consumer Discretionary,Catalog/Specialty Distribution
QXO,QXO Inc. Common Stock,$21.24,-0.31,-1.439%,14324086823.00,United States,,2451103,Consumer Discretionary,RETAIL: Building Materials
QXO^B,QXO Inc.  Depositary Shares each representing a 1/20th interest in a share of 5.50% Series B Mandatory Convertible Preferred Stock,$60.14,-0.60,-0.988%,,United States,,812,,
R,Ryder System Inc. Common Stock,$196.18,-1.59,-0.804%,7921068440.00,United States,,135892,Consumer Discretionary,Rental/Leasing Companies
RA,Brookfield Real Assets Income Fund Inc. Common Stock,$12.96,0.03,0.232%,0.00,United States,2016,231358,Finance,Investment Managers
RAAQ,Real Asset Acquisition Corp. Class A Ordinary Share,$10.23,0.00,0.00%,0.00,United States,2025,253,,
RAAQW,Real Asset Acquisition Corp. Warrants,$0.54,-0.032,-5.594%,0.00,United States,2025,137,,
RAC,Rithm Acquisition Corp. Class A Ordinary Shares,$10.40,0.08,0.775%,0.00,,2025,221,,
RACE,Ferrari N.V. Common Shares,$378.13,1.79,0.476%,91650092149.00,Italy,2015,173292,Industrials,Auto Manufacturing
RADX,Radiopharm Theranostics Limited American Depositary Shares,$5.50,0.01,0.182%,70147297.00,Australia,,99852,Health Care,Biotechnology: Pharmaceutical Preparations
RAIL,FreightCar America Inc. Common Stock,$11.50,-0.02,-0.174%,219409719.00,United States,2005,188599,Industrials,Railroads
RAIN,Rain Enhancement Technologies Holdco Inc. Class A Common Stock,$6.585,-0.6066,-8.435%,53923465.00,United States,,18300,Technology,Industrial Machinery/Components
RAINW,Rain Enhancement Technologies Holdco Inc. Warrants,$0.28,0.00,0.00%,2292873.00,United States,,16611,Technology,Industrial Machinery/Components
RAL,Ralliant Corporation Common Stock,$51.49,-0.16,-0.31%,5808372032.00,United States,2025,888935,Industrials,Industrial Machinery/Components
RAMP,LiveRamp Holdings Inc. Common Stock,$29.90,0.09,0.302%,1903100436.00,United States,2018,190631,Technology,EDP Services
RAND,Rand Capital Corporation Common Stock,$11.16,-0.19,-1.674%,33143124.00,United States,,26875,Finance,Finance: Consumer Services
RANGR,Range Capital Acquisition Corp. Rights,$0.45,0.00,0.00%,0.00,United States,2025,200,,
RANI,Rani Therapeutics Holdings Inc. Class A Common Stock,$1.40,-0.08,-5.405%,170129876.00,United States,2021,3047676,Health Care,Biotechnology: Pharmaceutical Preparations
RAPP,Rapport Therapeutics Inc. Common Stock,$30.20,-0.73,-2.36%,1439366368.00,United States,2024,221850,Health Care,Biotechnology: Pharmaceutical Preparations
RAPT,RAPT Therapeutics Inc. Common Stock,$35.42,-0.42,-1.172%,981519051.00,United States,2019,115888,Health Care,Biotechnology: Pharmaceutical Preparations
RARE,Ultragenyx Pharmaceutical Inc. Common Stock,$34.19,-0.39,-1.128%,3298568084.00,United States,2014,629157,Health Care,Biotechnology: Pharmaceutical Preparations
RAVE,Rave Restaurant Group Inc. Common Stock,$3.29,0.21,6.818%,46756052.00,United States,,87428,Consumer Discretionary,Food Distributors
RAY,Raytech Holding Limited Ordinary Shares,$2.26,0.33,17.098%,6158229.00,Hong Kong,2024,208651,Consumer Discretionary,Consumer Electronics/Appliances
RAYA,Erayak Power Solution Group Inc. Class A Ordinary Shares,$4.04,-0.27,-6.265%,3615683.00,China,2022,19386,Consumer Discretionary,Metal Fabrications
RBA,RB Global Inc. Common Stock,$105.41,-0.08,-0.076%,19573793931.00,Canada,,316421,Real Estate,Real Estate
RBB,RBB Bancorp Common Stock,$21.08,-0.21,-0.986%,359348589.00,United States,2017,19686,Finance,Major Banks
RBBN,Ribbon Communications Inc. Common Stock,$2.95,0.01,0.34%,520968791.00,United States,,603726,Technology,EDP Services
RBC,RBC Bearings Incorporated Common Stock,$456.33,-2.05,-0.447%,14425249328.00,United States,2022,100394,Industrials,Metal Fabrications
RBCAA,Republic Bancorp Inc. Class A Common Stock,$70.03,-0.28,-0.398%,1368201811.00,United States,1998,17274,Finance,Major Banks
RBKB,Rhinebeck Bancorp Inc. Common Stock,$12.33,0.13,1.066%,137426247.00,United States,2019,11651,Finance,Banks
RBLX,Roblox Corporation Class A Common Stock,$82.22,0.34,0.415%,57712315268.00,United States,2021,3862091,Technology,Computer Software: Prepackaged Software
RBNE,Robin Energy Ltd. Common Stock,$3.05,-0.171,-5.309%,8557525.00,Cyprus,,362201,Consumer Discretionary,Marine Transportation
RBOT,Vicarious Surgical Inc. Class A Common Stock,$1.95,-0.01,-0.51%,0.00,Hong Kong,2020,111493,Health Care,Industrial Specialties
RBRK,Rubrik Inc. Class A Common Stock,$78.66,-0.14,-0.178%,15743133930.00,United States,2024,1273593,Technology,Computer Software: Prepackaged Software
RC,Ready Capital Corporation Common Stock,$2.24,-0.04,-1.754%,363162858.00,United States,2013,3424904,Real Estate,Real Estate Investment Trusts
RC^C,Ready Capital Corporation 6.25% Series C Cumulative Convertible Preferred Stock,$14.165,0.365,2.645%,,United States,,5222,,
RC^E,Ready Capital Corporation 6.50% Series E Cumulative Redeemable Preferred Stock,$14.2301,0.0901,0.637%,,United States,,42622,,
RCAT,Red Cat Holdings Inc. Common Stock,$8.30,-0.79,-8.691%,990780454.00,United States,,6476510,Technology,Computer Software: Prepackaged Software
RCB,Ready Capital Corporation 6.20% Senior Notes due 2026,$24.49,-0.04,-0.163%,4024374891.00,United States,2019,890,Real Estate,Real Estate Investment Trusts
RCC,Ready Capital Corporation 5.75% Senior Notes due 2026,$25.0248,0.0248,0.099%,4112257116.00,United States,2021,1269,Real Estate,Real Estate Investment Trusts
RCD,Ready Capital Corporation 9.00% Senior Notes due 2029,$21.08,-0.15,-0.707%,0.00,United States,2024,12201,Real Estate,Real Estate Investment Trusts
RCEL,Avita Medical Inc. Common Stock,$3.44,-0.08,-2.273%,104896302.00,United States,,219021,Health Care,Medical/Dental Instruments
RCG,RENN Fund Inc Common Stock,$2.5604,0.0004,0.016%,0.00,United States,,4603,Finance,Investment Managers
RCI,Rogers Communication Inc. Common Stock,$37.41,0.14,0.376%,20209827650.00,Canada,,312702,Telecommunications,Cable & Other Pay Television Services
RCKT,Rocket Pharmaceuticals Inc. Common Stock,$3.48,-0.03,-0.855%,376613353.00,United States,2015,934514,Health Care,Biotechnology: Pharmaceutical Preparations
RCKTW,Rocket Pharmaceuticals Inc. Warrant,$0.0161,-0.0017,-9.551%,1742378.00,United States,,31344,Health Care,Biotechnology: Pharmaceutical Preparations
RCKY,Rocky Brands Inc. Common Stock,$30.02,-0.20,-0.662%,224960484.00,United States,1993,19026,Consumer Discretionary,Shoe Manufacturing
RCL,Royal Caribbean Cruises Ltd. Common Stock,$285.67,-8.45,-2.873%,77905914711.00,United States,1993,986247,Consumer Discretionary,Marine Transportation
RCMT,RCM Technologies Inc. Common Stock,$20.30,-0.20,-0.976%,150433353.00,United States,,42391,Consumer Discretionary,Professional Services
RCON,Recon Technology Ltd. Class A Ordinary Shares,$1.38,0.12,9.524%,42265848.00,China,2009,21159,Energy,Oilfield Services/Equipment
RCS,PIMCO Strategic Income Fund Inc.,$6.27,-0.06,-0.948%,0.00,United States,1994,157535,Finance,Investment Managers
RCT,RedCloud Holdings plc Ordinary Shares,$1.44,0.01,0.699%,63686354.00,United Kingdom,2025,44016,Technology,Computer Software: Programming Data Processing
RCUS,Arcus Biosciences Inc. Common Stock,$23.09,-0.03,-0.13%,2493108946.00,United States,2018,694857,Health Care,Biotechnology: Pharmaceutical Preparations
RDAC,Rising Dragon Acquisition Corp. Ordinary Shares,$10.97,0.48,4.576%,0.00,China,2024,29479,,
RDACR,Rising Dragon Acquisition Corp. Rights,$0.1817,-0.0243,-11.796%,0.00,China,2024,297,Finance,Blank Checks
RDAG,Republic Digital Acquisition Company Class A Ordinary Shares,$10.13,0.01,0.099%,0.00,United States,2025,796,Finance,Blank Checks
RDAGW,Republic Digital Acquisition Company Warrants,$0.55,0.05,10.00%,0.00,United States,2025,100,Finance,Blank Checks
RDCM,Radcom Ltd. Ordinary Shares,$13.59,0.19,1.418%,216293221.00,Israel,1997,32806,Technology,Computer peripheral equipment
RDDT,Reddit Inc. Class A Common Stock,$225.77,-0.08,-0.035%,42782458864.00,United States,2024,1900245,Technology,EDP Services
RDGT,Ridgetech Inc. Ordinary Shares,$3.22,-0.18,-5.294%,58879754.00,China,,5862,Consumer Staples,Retail-Drug Stores and Proprietary Stores
RDHL,Redhill Biopharma Ltd. American Depositary Shares,$1.14,-0.01,-0.87%,3796037.00,Israel,,25784,Health Care,Biotechnology: Pharmaceutical Preparations
RDI,Reading International Inc Class A Common Stock,$1.04,-0.03,-2.804%,23625950.00,United States,,86245,Consumer Discretionary,Movies/Entertainment
RDIB,Reading International Inc Class B Common Stock,$11.52,0.22,1.947%,261702835.00,United States,,1899,Consumer Discretionary,Movies/Entertainment
RDN,Radian Group Inc. Common Stock,$36.44,-0.23,-0.627%,4937221310.00,United States,,397803,Finance,Property-Casualty Insurers
RDNT,RadNet Inc. Common Stock,$73.15,0.21,0.288%,5653211803.00,United States,,378971,Health Care,Medical Specialities
RDNW,RideNow Group Inc. Class B Common Stock,$5.46,0.12,2.247%,207848561.00,United States,,29067,Technology,EDP Services
RDVT,Red Violet Inc. Common Stock ,$55.23,-0.87,-1.551%,771661906.00,United States,,38391,Technology,Computer Software: Prepackaged Software
RDW,Redwire Corporation Common Stock,$7.15,-0.67,-8.568%,1180828098.00,United States,2021,12227300,Industrials,Military/Government/Technical
RDWR,Radware Ltd. Ordinary Shares,$24.37,0.09,0.371%,1040270834.00,Israel,1999,117414,Real Estate,Real Estate
RDY,Dr. Reddy's Laboratories Ltd Common Stock,$14.16,0.07,0.497%,11815887968.00,India,,969437,Health Care,Biotechnology: Pharmaceutical Preparations
RDZN,Roadzen Inc. Ordinary Shares,$2.05,0.00,0.00%,162349889.00,United States,2022,109234,Finance,Specialty Insurers
RDZNW,Roadzen Inc. Warrants,$0.248,-0.017,-6.415%,19640377.00,United States,2022,3475,Finance,Specialty Insurers
REAL,The RealReal Inc. Common Stock,$16.21,-0.025,-0.154%,1891428950.00,United States,2019,1547329,Consumer Discretionary,Other Specialty Stores
REAX,The Real Brokerage Inc. Common Shares,$3.69,-0.19,-4.897%,781542000.00,Canada,,1718379,Finance,Real Estate
REBN,Reborn Coffee Inc. Common Stock,$1.47,0.02,1.379%,8785193.00,United States,2022,41665,Consumer Discretionary,Restaurants
RECT,Rectitude Holdings Ltd Ordinary Shares,$1.7006,0.0106,0.627%,24658700.00,Singapore,2024,3605,Consumer Discretionary,Industrial Machinery/Components
REE,REE Automotive Ltd. Class A Ordinary Shares,$0.7565,-0.014,-1.817%,23467335.00,Israel,,170109,Industrials,Auto Manufacturing
REED,Reed's Inc. Common Stock,$2.60,-0.125,-4.587%,0.00,,2025,16747,,
REFI,Chicago Atlantic Real Estate Finance Inc. Common Stock,$13.13,0.19,1.468%,276718663.00,United States,2021,93129,Real Estate,Real Estate Investment Trusts
REFR,Research Frontiers Incorporated Common Stock,$1.38,-0.01,-0.719%,46434545.00,United States,,96016,Miscellaneous,Multi-Sector Companies
REG,Regency Centers Corporation Common Stock,$69.55,0.00,0.00%,12720763020.00,United States,1993,479009,Real Estate,Real Estate Investment Trusts
REGCO,Regency Centers Corporation 5.875% Series B Cumulative Redeemable Preferred Stock,$22.40,0.05,0.224%,4096981907.00,United States,,521,Real Estate,Real Estate Investment Trusts
REGCP,Regency Centers Corporation 6.25% Series A Cumulative Redeemable Preferred Stock,$23.28,-0.12,-0.513%,4257934768.00,United States,,9109,Real Estate,Real Estate Investment Trusts
REGN,Regeneron Pharmaceuticals Inc. Common Stock,$784.97,1.26,0.161%,82499926256.00,United States,1991,321041,Health Care,Biotechnology: Pharmaceutical Preparations
